puzzle_id,sub_puzzle_id,image_path,origin_question,true_answer,sub_question,answer,level,sub_question_id,subquestion_image_path
100,478,100/img/puzzle_100_478.png,"Cristina encrypts words adopting the grid depicted. For an example, the word HVN is encrypyed as PQ HX OX. What word did Cristina encrypt HQ PQ OQ? A: UTL,B: YHW,C: HIS,D: YHW,E: HWO",B,nan,NO_FINAL_ANSWER,nan,100-478-1,nan
100,479,100/img/puzzle_100_479.png,"Jennifer encrypts words as the lattice pictured. For an illustration, the word PEIDG is encrypyed as TF TR PH PR JR. What word did Jennifer encrypt JH NM JM VR PC? A: BGTDR,B: BKWJC,C: BDRUH,D: BKCWJ,E: OJQRH",B,nan,NO_FINAL_ANSWER,nan,100-479-1,nan
100,480,100/img/puzzle_100_480.png,"Crystal encrypts words adopting the lattice displayed. For example, the word SHDXG is encrypyed as GQ HY HQ XS UD. What word did Crystal encrypt HS XQ GS UY XP? A: OFPJQ,B: FYGKQ,C: NRBGO,D: KQNUR,E: KQNUR",D,nan,NO_FINAL_ANSWER,nan,100-480-1,nan
100,481,100/img/puzzle_100_481.png,"Paul conceals words applying the board depicted. For an illustration, the word ULRCE is concealed as XO IO IP LG XB. What word did Paul conceal FS DS XP DP FP? A: JMOFG,B: MUYAO,C: UNDKC,D: VJGFU,E: BJIUQ",A,nan,NO_FINAL_ANSWER,nan,100-481-1,nan
100,482,100/img/puzzle_100_482.png,"Hannah represents words with the grid presented. For an example, the word MLYGR is represented as PC PI TI AI XV. What word did Hannah represent DI XC XI TK PV? A: MACBP,B: UAVWK,C: UWVAK,D: BLSTU,E: HYSUI",B,nan,NO_FINAL_ANSWER,nan,100-482-1,nan
100,483,100/img/puzzle_100_483.png,"Gabriel represents words as the matrix shown. For an example, the word WGL is represented as CO TL TM. What word did Gabriel represent UO TM UL? A: EDB,B: IMA,C: QOD,D: OLV,E: OLV",D,nan,NO_FINAL_ANSWER,nan,100-483-1,nan
100,484,100/img/puzzle_100_484.png,"Thomas encodes words applying the board presented. For an example, the word AYFH is encoded as WI JZ JI WZ. What word did Thomas encode JD JI JH WZ? A: XSJT,B: ARSQ,C: FKCH,D: VWMQ,E: MFPH",E,nan,NO_FINAL_ANSWER,nan,100-484-1,nan
100,485,100/img/puzzle_100_485.png,"Michael encodes words employing the lattice displayed. For example, the word WGIXK is encoded as SZ BZ IR MF SR. What word did Michael encode IF XW BW MG MR? A: EPKGF,B: QFCOR,C: FAYDH,D: YFPLD,E: QFOCR",B,nan,NO_FINAL_ANSWER,nan,100-485-1,nan
100,486,100/img/puzzle_100_486.png,"Jasmine conceals words applying the lattice presented. For instance, the word UQK is concealed as EK SO YM. What word did Jasmine conceal SK YO YK? A: LDG,B: COE,C: WKS,D: COE,E: AJR",B,nan,NO_FINAL_ANSWER,nan,100-486-1,nan
100,487,100/img/puzzle_100_487.png,"Dustin encodes words employing the grid pictured. For example, the word DYLE is encoded as SJ DF SU DJ. What word did Dustin encode ZU SW SF DW? A: OJHA,B: VNKW,C: OJAH,D: MTPY,E: GRLT",C,nan,NO_FINAL_ANSWER,nan,100-487-1,nan
100,488,100/img/puzzle_100_488.png,"Vickie encrypts words applying the board shown. For an illustration, the word ATDX is encrypyed as YX MX YW MD. What word did Vickie encrypt YW EU YX MW? A: QGNB,B: DSAO,C: NCGB,D: WKNG,E: DOSA",B,nan,NO_FINAL_ANSWER,nan,100-488-1,nan
100,489,100/img/puzzle_100_489.png,"Rachel encrypts words applying the matrix depicted. For example, the word OLCBN is encrypyed as IU XA OA XN EK. What word did Rachel encrypt ER QK IR OU QA? A: AGYPJ,B: YDNOX,C: AGYPJ,D: MXNFT,E: KUHOM",A,nan,NO_FINAL_ANSWER,nan,100-489-1,nan
100,490,100/img/puzzle_100_490.png,"Jorge encrypts words applying the matrix pictured. For an example, the word LOGSV is encrypyed as PD ED GW EB VN. What word did Jorge encrypt PN EB QN VB PB? A: KGNMC,B: RSHMP,C: MNIUE,D: TSWDK,E: WKQYA",B,nan,NO_FINAL_ANSWER,nan,100-490-1,nan
100,491,100/img/puzzle_100_491.png,"Justin represents words applying the matrix presented. For an illustration, the word YIXJE is represented as ND JP XT MY XD. What word did Justin represent GT XP NP GP NY? A: AXFLG,B: BLUOQ,C: BLQUO,D: BFNAY,E: HBWON",B,nan,NO_FINAL_ANSWER,nan,100-491-1,nan
100,492,100/img/puzzle_100_492.png,"Melissa encodes words adopting the lattice shown. For an illustration, the word OIBU is encoded as XR YK ER YP. What word did Melissa encode YR XP EP XK? A: XMTG,B: APCE,C: XMTG,D: UXDM,E: RSNF",A,nan,NO_FINAL_ANSWER,nan,100-492-1,nan
100,493,100/img/puzzle_100_493.png,"Frank ciphers words with the board depicted. For an illustration, the word BDOW is ciphered as QT RV CT QV. What word did Frank cipher QV CK RK CV? A: BFRA,B: WLHM,C: WLMH,D: PGOV,E: LKJH",B,nan,NO_FINAL_ANSWER,nan,100-493-1,nan
100,494,100/img/puzzle_100_494.png,"Bruce ciphers words adopting the matrix shown. For instance, the word DWBJM is ciphered as GR GB YB PD LD. What word did Bruce cipher LH PR ER ED GR? A: BPJTV,B: EGKSJ,C: EHVRD,D: GAEYK,E: JPMRO",C,nan,NO_FINAL_ANSWER,nan,100-494-1,nan
100,495,100/img/puzzle_100_495.png,"Christine ciphers words applying the grid displayed. For instance, the word NPCD is ciphered as EF LF EN OK. What word did Christine cipher OZ OK EN EK? A: AOBU,B: SEVR,C: OCVR,D: QDHE,E: KDCQ",E,nan,NO_FINAL_ANSWER,nan,100-495-1,nan
100,496,100/img/puzzle_100_496.png,"Melissa ciphers words using the matrix displayed. For an illustration, the word KLVCY is ciphered as TI MX QZ PI PX. What word did Melissa cipher MZ EG QZ PL TX? A: GWVTX,B: GVXWT,C: KERPT,D: WUBRY,E: ICARN",A,nan,NO_FINAL_ANSWER,nan,100-496-1,nan
100,497,100/img/puzzle_100_497.png,"Nicholas represents words applying the board pictured. For an illustration, the word RQYO is represented as FH BC IH BH. What word did Nicholas represent IG MG IC FG? A: VAQT,B: LFWH,C: EPWU,D: LWFH,E: LBEP",D,nan,NO_FINAL_ANSWER,nan,100-497-1,nan
100,498,100/img/puzzle_100_498.png,"Bridget represents words applying the grid shown. For an illustration, the word FERAS is represented as GJ LU LN LJ KJ. What word did Bridget represent KJ GM QJ GJ GN? A: SYWFG,B: FLPMU,C: SYGFW,D: AKPWE,E: LWEPQ",C,nan,NO_FINAL_ANSWER,nan,100-498-1,nan
100,499,100/img/puzzle_100_499.png,"Deborah conceals words adopting the lattice depicted. For an illustration, the word JID is concealed as CV PM TV. What word did Deborah conceal PV CM CV? A: YCS,B: JCK,C: XFY,D: EPJ,E: DRU",D,nan,NO_FINAL_ANSWER,nan,100-499-1,nan
100,500,100/img/puzzle_100_500.png,"Chelsea encodes words using the grid depicted. For instance, the word UDQ is encoded as QT QV JI. What word did Chelsea encode LI JT LV? A: IWN,B: TGS,C: OUV,D: IWN,E: KIN",A,nan,NO_FINAL_ANSWER,nan,100-500-1,nan
100,501,100/img/puzzle_100_501.png,"Emily conceals words applying the matrix presented. For an illustration, the word JTEAH is concealed as NU ZH XL XB PL. What word did Emily conceal RL PB XL ZL NL? A: AVEGN,B: NQEDG,C: UQFDS,D: DWNMU,E: NGQDE",B,nan,NO_FINAL_ANSWER,nan,100-501-1,nan
100,502,100/img/puzzle_100_502.png,"Rachel conceals words applying the matrix shown. For example, the word GKL is concealed as NR NZ UR. What word did Rachel conceal OR OZ UZ? A: HUQ,B: BNO,C: RHX,D: FRE,E: HUQ",A,nan,NO_FINAL_ANSWER,nan,100-502-1,nan
100,503,100/img/puzzle_100_503.png,"Johnny conceals words applying the board shown. For example, the word QALRM is concealed as KX LQ ZQ LP VX. What word did Johnny conceal VQ VX LE KD VP? A: UNBWX,B: NMWXG,C: NMXWG,D: CDOFE,E: SWVYM",C,nan,NO_FINAL_ANSWER,nan,100-503-1,nan
100,504,100/img/puzzle_100_504.png,"Victor encodes words as the board pictured. For an illustration, the word AGVB is encoded as OI KA FW OA. What word did Victor encode LW LA FQ FA? A: PMJF,B: NGUW,C: PYEN,D: XPCT,E: VMFW",C,nan,NO_FINAL_ANSWER,nan,100-504-1,nan
100,505,100/img/puzzle_100_505.png,"Michael encrypts words applying the grid shown. For an illustration, the word UQB is encrypyed as GK PL FC. What word did Michael encrypt GC PC GL? A: FAV,B: TPB,C: XHI,D: KUY,E: FVA",A,nan,NO_FINAL_ANSWER,nan,100-505-1,nan
100,506,100/img/puzzle_100_506.png,"Carrie encrypts words adopting the lattice presented. For example, the word HBV is encrypyed as EV WV WZ. What word did Carrie encrypt WC EZ EC? A: EUJ,B: KSY,C: BEF,D: TWS,E: SAU",A,nan,NO_FINAL_ANSWER,nan,100-506-1,nan
100,507,100/img/puzzle_100_507.png,"Joseph ciphers words adopting the board demonstrated. For an illustration, the word LCIWT is ciphered as ZL JY JL DK SL. What word did Joseph cipher JL SK ZB DB DH? A: JDGKH,B: INQEX,C: JBOFT,D: CBKNG,E: GKEPX",B,nan,NO_FINAL_ANSWER,nan,100-507-1,nan
100,508,100/img/puzzle_100_508.png,"Nicholas encrypts words adopting the lattice demonstrated. For an illustration, the word JUCN is encrypyed as YT CT CR YR. What word did Nicholas encrypt JD YR JO CR? A: FNKC,B: EKIF,C: FNKC,D: VRAC,E: XRUK",A,nan,NO_FINAL_ANSWER,nan,100-508-1,nan
100,509,100/img/puzzle_100_509.png,"Christine ciphers words applying the lattice shown. For an example, the word IVTC is ciphered as QC UC HA HC. What word did Christine cipher HA OS US HS? A: TRSY,B: UQAI,C: TAUX,D: YXTN,E: EONS",A,nan,NO_FINAL_ANSWER,nan,100-509-1,nan
100,510,100/img/puzzle_100_510.png,"Lisa encrypts words adopting the lattice depicted. For an example, the word CMH is encrypyed as PZ AI PN. What word did Lisa encrypt PZ RI AZ? A: CLU,B: CUL,C: FGC,D: YTW,E: USK",A,nan,NO_FINAL_ANSWER,nan,100-510-1,nan
100,511,100/img/puzzle_100_511.png,"John conceals words using the grid depicted. For an example, the word QYRS is concealed as SX QZ SD RX. What word did John conceal QG RD RG QX? A: LIJT,B: LTJI,C: UINJ,D: UMFG,E: JQCA",A,nan,NO_FINAL_ANSWER,nan,100-511-1,nan
100,512,100/img/puzzle_100_512.png,"Denise encodes words as the lattice presented. For example, the word CAR is encoded as QL FO QA. What word did Denise encode FL QA QL? A: JIT,B: ERC,C: PQA,D: LIN,E: JFV",B,nan,NO_FINAL_ANSWER,nan,100-512-1,nan
100,513,100/img/puzzle_100_513.png,"Charles represents words using the grid pictured. For an illustration, the word YXLHR is represented as UM UF AL ZM ZL. What word did Charles represent UF CO ZB UM UO? A: XUAYD,B: ALCXW,C: CXJGN,D: QFOWY,E: NFYSR",A,nan,NO_FINAL_ANSWER,nan,100-513-1,nan
100,514,100/img/puzzle_100_514.png,"Matthew encrypts words applying the lattice presented. For an example, the word WHUO is encrypyed as FB FO QB HB. What word did Matthew encrypt HA HU QB FU? A: MXDI,B: NCEP,C: NUFL,D: YERG,E: NLUF",E,nan,NO_FINAL_ANSWER,nan,100-514-1,nan
100,515,100/img/puzzle_100_515.png,"Michael represents words employing the grid pictured. For example, the word CJHGM is represented as EJ GA NJ EU GD. What word did Michael represent GV CU GA EV OV? A: NITYR,B: WIJNE,C: OPKHN,D: WINEJ,E: SFXEM",B,nan,NO_FINAL_ANSWER,nan,100-515-1,nan
100,516,100/img/puzzle_100_516.png,"Sylvia conceals words adopting the grid demonstrated. For example, the word MTV is concealed as YM YA LA. What word did Sylvia conceal LM YA KR? A: AFS,B: GKD,C: ETR,D: ETR,E: UFM",C,nan,NO_FINAL_ANSWER,nan,100-516-1,nan
100,517,100/img/puzzle_100_517.png,"Tyler encrypts words applying the board displayed. For instance, the word LDI is encrypyed as GE GO VZ. What word did Tyler encrypt JO VO GZ? A: APL,B: MFG,C: PCB,D: TFX,E: PBC",C,nan,NO_FINAL_ANSWER,nan,100-517-1,nan
100,518,100/img/puzzle_100_518.png,"Anthony encodes words with the board depicted. For an example, the word GDAP is encoded as FE BE FL UT. What word did Anthony encode RT UT UL BT? A: GYXA,B: XIPU,C: CQYE,D: FDTE,E: XPIU",E,nan,NO_FINAL_ANSWER,nan,100-518-1,nan
100,519,100/img/puzzle_100_519.png,"Melissa ciphers words using the board pictured. For an illustration, the word MLCNE is ciphered as EK VT GP EA HP. What word did Melissa cipher EK HK EF GP VP? A: OMAWV,B: CRVXK,C: VXJSR,D: MHPCD,E: MCHDP",D,nan,NO_FINAL_ANSWER,nan,100-519-1,nan
100,520,100/img/puzzle_100_520.png,"Sylvia conceals words adopting the board pictured. For an example, the word VCG is concealed as IT JE JK. What word did Sylvia conceal JT VK VE? A: JOS,B: SXT,C: SXT,D: FGQ,E: ITF",B,nan,NO_FINAL_ANSWER,nan,100-520-1,nan
100,521,100/img/puzzle_100_521.png,"Amber ciphers words applying the lattice displayed. For instance, the word INK is ciphered as RX RK PX. What word did Amber cipher PV QV RV? A: GFD,B: ECU,C: BFI,D: HEW,E: THM",B,nan,NO_FINAL_ANSWER,nan,100-521-1,nan
100,522,100/img/puzzle_100_522.png,"Katherine conceals words as the matrix displayed. For an illustration, the word AORN is concealed as JA YA OU YH. What word did Katherine conceal JH YU YV XV? A: HODX,B: EMWL,C: EMLW,D: WGQD,E: KONJ",B,nan,NO_FINAL_ANSWER,nan,100-522-1,nan
100,523,100/img/puzzle_100_523.png,"Rachel encrypts words applying the lattice presented. For instance, the word KPCWU is encrypyed as EV GV KA SW KT. What word did Rachel encrypt GA ET XA KA XV? A: UBOJH,B: ARQCM,C: AMRCQ,D: VDYLC,E: HCYTO",C,nan,NO_FINAL_ANSWER,nan,100-523-1,nan
100,524,100/img/puzzle_100_524.png,"Kenneth encodes words with the lattice pictured. For instance, the word MDEKY is encoded as VZ MH BX BY VY. What word did Kenneth encode VH BZ VL MZ VY? A: RTJAY,B: RTAJY,C: ABSMC,D: IFOMS,E: VYCEG",B,nan,NO_FINAL_ANSWER,nan,100-524-1,nan
100,525,100/img/puzzle_100_525.png,"Paige encodes words using the grid shown. For instance, the word QVRJ is encoded as UM XQ AL AQ. What word did Paige encode XM DQ AL DM? A: DURY,B: IEQU,C: WQGK,D: SQIX,E: DURY",A,nan,NO_FINAL_ANSWER,nan,100-525-1,nan
100,526,100/img/puzzle_100_526.png,"Denise encodes words applying the grid presented. For instance, the word XOL is encoded as ZM TF TM. What word did Denise encode QM ZO ZF? A: JIF,B: AUI,C: TIE,D: JIF,E: AML",A,nan,NO_FINAL_ANSWER,nan,100-526-1,nan
100,527,100/img/puzzle_100_527.png,"Derrick conceals words employing the board displayed. For an illustration, the word WCB is concealed as PV AU HM. What word did Derrick conceal HU AM PU? A: LWM,B: IGV,C: VJK,D: MCS,E: IGV",B,nan,NO_FINAL_ANSWER,nan,100-527-1,nan
100,528,100/img/puzzle_100_528.png,"Denise ciphers words using the lattice depicted. For an illustration, the word GBN is ciphered as LN JN JK. What word did Denise cipher JT BN LT? A: MVX,B: HSX,C: RYF,D: REO,E: HLQ",B,nan,NO_FINAL_ANSWER,nan,100-528-1,nan
100,529,100/img/puzzle_100_529.png,"Jose ciphers words using the board displayed. For an illustration, the word PBFVE is ciphered as LQ DG LG LC MG. What word did Jose cipher NB XP NQ LP XC? A: BRUEO,B: HCDIM,C: FLEHT,D: JKTSD,E: JKTSD",D,nan,NO_FINAL_ANSWER,nan,100-529-1,nan
100,530,100/img/puzzle_100_530.png,"Michael represents words employing the lattice shown. For example, the word DGBJ is represented as AR JQ KQ YQ. What word did Michael represent AB KR JQ YR? A: YUGO,B: LYNC,C: XTUK,D: ICPG,E: YUGO",A,nan,NO_FINAL_ANSWER,nan,100-530-1,nan
100,531,100/img/puzzle_100_531.png,"Albert encodes words employing the matrix displayed. For example, the word AFKBD is encoded as RA EN CF OG VF. What word did Albert encode CA EG VF EA EN? A: RTSDF,B: RTDSF,C: AGOYJ,D: JHMQT,E: WYQUR",B,nan,NO_FINAL_ANSWER,nan,100-531-1,nan
100,532,100/img/puzzle_100_532.png,"Stephen conceals words applying the matrix displayed. For example, the word CIBN is concealed as DY GY NY HJ. What word did Stephen conceal HQ HJ GS GQ? A: UWLY,B: CLKS,C: PNAT,D: PNTA,E: VYNH",C,nan,NO_FINAL_ANSWER,nan,100-532-1,nan
100,533,100/img/puzzle_100_533.png,"Carl encodes words employing the grid displayed. For instance, the word BSGNI is encoded as HO PE PO KO PR. What word did Carl encode HB PR PB VE PO? A: MPDVI,B: UHKYC,C: TIXYG,D: ANPFL,E: TIXYG",C,nan,NO_FINAL_ANSWER,nan,100-533-1,nan
100,534,100/img/puzzle_100_534.png,"John encodes words as the board pictured. For an illustration, the word UXQT is encoded as YT GH EH GT. What word did John encode YP ET GL GP? A: CPDJ,B: KRFN,C: CJDP,D: DLAI,E: QTFY",A,nan,NO_FINAL_ANSWER,nan,100-534-1,nan
100,535,100/img/puzzle_100_535.png,"Kevin encrypts words with the board shown. For example, the word LRVBY is encrypyed as ID PV ED IA RO. What word did Kevin encrypt IU EU PA RU ID? A: UAESW,B: NGCQS,C: YRMBQ,D: MLCSA,E: MSCAL",E,nan,NO_FINAL_ANSWER,nan,100-535-1,nan
100,536,100/img/puzzle_100_536.png,"Jon ciphers words applying the lattice depicted. For instance, the word EBI is ciphered as XS OZ EZ. What word did Jon cipher XA EA OS? A: LTO,B: GPM,C: RPU,D: LTO,E: NHS",A,nan,NO_FINAL_ANSWER,nan,100-536-1,nan
100,537,100/img/puzzle_100_537.png,"Kevin encrypts words applying the matrix demonstrated. For an illustration, the word ETON is encrypyed as AE YW QH YB. What word did Kevin encrypt QW YH YE QE? A: NRAH,B: SKCA,C: SKAC,D: DYEO,E: OSGU",B,nan,NO_FINAL_ANSWER,nan,100-537-1,nan
100,538,100/img/puzzle_100_538.png,"Gabriel ciphers words as the matrix displayed. For example, the word HDNS is ciphered as KJ SJ EZ SD. What word did Gabriel cipher KH SZ KJ EJ? A: TPHI,B: IEQH,C: TPIH,D: EHRP,E: YVAD",A,nan,NO_FINAL_ANSWER,nan,100-538-1,nan
100,539,100/img/puzzle_100_539.png,"Mary represents words employing the lattice displayed. For an example, the word CSWA is represented as ZT RP EA GO. What word did Mary represent GP RO EP EO? A: QRGD,B: BQIF,C: KMSD,D: HOGK,E: QDGR",A,nan,NO_FINAL_ANSWER,nan,100-539-1,nan
100,540,100/img/puzzle_100_540.png,"Nicholas conceals words applying the lattice depicted. For example, the word UBN is concealed as NM JG EG. What word did Nicholas conceal EZ EM NG? A: YTK,B: HOA,C: JCH,D: NDW,E: BCW",A,nan,NO_FINAL_ANSWER,nan,100-540-1,nan
100,541,100/img/puzzle_100_541.png,"Gabriel encodes words adopting the lattice depicted. For an example, the word JCYE is encoded as TK GH GS TR. What word did Gabriel encode DH TS NK TR? A: RUCF,B: PRSQ,C: KQNF,D: FINE,E: PLNK",D,nan,NO_FINAL_ANSWER,nan,100-541-1,nan
100,542,100/img/puzzle_100_542.png,"Tina represents words using the grid displayed. For an example, the word HQMUO is represented as LA HF QC BF MF. What word did Tina represent MF BA QF LD MU? A: DPNUQ,B: LICKH,C: YAOKE,D: RKETL,E: OTGFJ",E,nan,NO_FINAL_ANSWER,nan,100-542-1,nan
100,543,100/img/puzzle_100_543.png,"Johnny ciphers words as the lattice pictured. For an illustration, the word SFGQ is ciphered as TD PI KI MB. What word did Johnny cipher PB PI TI KB? A: ECHO,B: PFWX,C: PFXW,D: ORUP,E: AONC",C,nan,NO_FINAL_ANSWER,nan,100-543-1,nan
100,544,100/img/puzzle_100_544.png,"Jose encrypts words applying the lattice shown. For instance, the word FKNGS is encrypyed as RH IL RG OH QG. What word did Jose encrypt DZ QH OH QL QZ? A: KGNFW,B: CDGPV,C: GFXME,D: CGPDV,E: IGBSL",B,nan,NO_FINAL_ANSWER,nan,100-544-1,nan
100,545,100/img/puzzle_100_545.png,"Christopher ciphers words adopting the lattice pictured. For example, the word TXIOG is ciphered as EG JB DS XS XG. What word did Christopher cipher EB JB OB XS XB? A: DWELV,B: YXLOJ,C: JRCOU,D: KPTSH,E: YXLOJ",B,nan,NO_FINAL_ANSWER,nan,100-545-1,nan
100,546,100/img/puzzle_100_546.png,"Nicholas encodes words applying the board shown. For instance, the word ALREF is encoded as UA FO UO UK QI. What word did Nicholas encode GI EK GY UI QO? A: KOXVP,B: MUTLB,C: JVRHA,D: CXTOD,E: IXPUR",D,nan,NO_FINAL_ANSWER,nan,100-546-1,nan
100,547,100/img/puzzle_100_547.png,"Melissa represents words using the grid presented. For an illustration, the word LSE is represented as FH KV YE. What word did Melissa represent YV FV YH? A: AGS,B: OTL,C: MNR,D: GVR,E: MNR",C,nan,NO_FINAL_ANSWER,nan,100-547-1,nan
100,548,100/img/puzzle_100_548.png,"Thomas ciphers words with the matrix presented. For an illustration, the word RUCBW is ciphered as GP GX KZ KH KM. What word did Thomas cipher AM SX GX IM GH? A: PAUOS,B: UFBAR,C: BKGSF,D: CKVSF,E: PASOU",A,nan,NO_FINAL_ANSWER,nan,100-548-1,nan
100,549,100/img/puzzle_100_549.png,"Christopher conceals words applying the lattice presented. For instance, the word JRAF is concealed as FO GH FW YS. What word did Christopher conceal FS ZS FH YO? A: FDCG,B: LISX,C: FQHJ,D: LSIX,E: VJHU",D,nan,NO_FINAL_ANSWER,nan,100-549-1,nan
100,550,100/img/puzzle_100_550.png,"Felicia ciphers words applying the board presented. For instance, the word VOSJR is ciphered as KB ZT SD ST KP. What word did Felicia cipher RB EB ZT KP ZD? A: XPOIE,B: AMSXR,C: QMUWD,D: AIRPF,E: UPORF",E,nan,NO_FINAL_ANSWER,nan,100-550-1,nan
100,551,100/img/puzzle_100_551.png,"Jennifer encrypts words adopting the board demonstrated. For example, the word UVGA is encrypyed as SR SC VZ JD. What word did Jennifer encrypt GZ JR VZ JZ? A: FOCI,B: BSWT,C: YJGW,D: YGJW,E: NHKG",C,nan,NO_FINAL_ANSWER,nan,100-551-1,nan
100,552,100/img/puzzle_100_552.png,"Melissa encodes words as the matrix shown. For an example, the word WSECU is encoded as OW NE GB OH NB. What word did Melissa encode NX MB OH OE NW? A: DFXSN,B: KQGBO,C: BKICJ,D: BKCIJ,E: JSUKH",D,nan,NO_FINAL_ANSWER,nan,100-552-1,nan
100,553,100/img/puzzle_100_553.png,"Charles encodes words applying the board presented. For example, the word SAR is encoded as LZ LD NI. What word did Charles encode CD LI CI? A: FMB,B: FBM,C: BHY,D: XPH,E: DCR",A,nan,NO_FINAL_ANSWER,nan,100-553-1,nan
100,554,100/img/puzzle_100_554.png,"Erin encodes words as the lattice presented. For example, the word PIWS is encoded as BZ TW YU BU. What word did Erin encode XD TZ YZ XZ? A: TUSY,B: KWPC,C: XDBY,D: QBAN,E: XYDB",C,nan,NO_FINAL_ANSWER,nan,100-554-1,nan
100,555,100/img/puzzle_100_555.png,"Jasmine conceals words employing the lattice depicted. For instance, the word TEYU is concealed as LK DK AU LV. What word did Jasmine conceal DK DO DV XU? A: EXNW,B: OKPX,C: PYFX,D: EWXN,E: IWFS",A,nan,NO_FINAL_ANSWER,nan,100-555-1,nan
100,556,100/img/puzzle_100_556.png,"Amber ciphers words as the board pictured. For an illustration, the word OXIS is ciphered as BN PN JZ JD. What word did Amber cipher UQ UN BZ BD? A: MJEN,B: LSGV,C: LCHU,D: CQBP,E: VQFA",E,nan,NO_FINAL_ANSWER,nan,100-556-1,nan
100,557,100/img/puzzle_100_557.png,"Joseph represents words using the board depicted. For instance, the word TFJCS is represented as CK UW EW PR SW. What word did Joseph represent UB PW CB EW SZ? A: DBKJQ,B: OQLAD,C: DAQKR,D: DBJKQ,E: DMSKQ",A,nan,NO_FINAL_ANSWER,nan,100-557-1,nan
100,558,100/img/puzzle_100_558.png,"Christine ciphers words using the matrix shown. For an illustration, the word FOLJG is ciphered as KB CQ GN SL SQ. What word did Christine cipher GR WB WN SQ CR? A: KBCRY,B: ICSDW,C: AQWGX,D: AXQGW,E: DAFCN",D,nan,NO_FINAL_ANSWER,nan,100-558-1,nan
100,559,100/img/puzzle_100_559.png,"Tyler represents words applying the board pictured. For instance, the word RXGE is represented as HN HP SI SP. What word did Tyler represent HP ON OP LP? A: XCYP,B: ATYU,C: NQCO,D: XFJL,E: YAPX",A,nan,NO_FINAL_ANSWER,nan,100-559-1,nan
100,560,100/img/puzzle_100_560.png,"Danielle encrypts words as the board displayed. For an example, the word UCJRY is encrypyed as VW VQ HS GS RI. What word did Danielle encrypt YQ HS RI RO YI? A: HFWIU,B: HJYKD,C: JVSDT,D: YMKXB,E: KYSFE",B,nan,NO_FINAL_ANSWER,nan,100-560-1,nan
100,561,100/img/puzzle_100_561.png,"Derrick encodes words with the grid shown. For an illustration, the word VDNG is encoded as YT FP YX JI. What word did Derrick encode YP YI RP JP? A: FVQM,B: KIWQ,C: FPAC,D: TXQG,E: KHJL",C,nan,NO_FINAL_ANSWER,nan,100-561-1,nan
100,562,100/img/puzzle_100_562.png,"Sandra represents words using the grid demonstrated. For an example, the word EUS is represented as VJ NP AO. What word did Sandra represent NO VP AP? A: FGW,B: NRP,C: YEN,D: KLF,E: NRP",B,nan,NO_FINAL_ANSWER,nan,100-562-1,nan
100,563,100/img/puzzle_100_563.png,"Jeff conceals words as the matrix shown. For an example, the word RJTK is concealed as FP FB WU QP. What word did Jeff conceal WB WU ID WD? A: RWUE,B: WTVE,C: VHBP,D: MCUN,E: IEWS",B,nan,NO_FINAL_ANSWER,nan,100-563-1,nan
100,564,100/img/puzzle_100_564.png,"Stephen encodes words as the lattice depicted. For example, the word RUHGP is encoded as PM ZM VU NI VT. What word did Stephen encode NM SM ZT SU ZI? A: OIXVQ,B: GTJFW,C: KQGLD,D: OXIVQ,E: NLUPG",D,nan,NO_FINAL_ANSWER,nan,100-564-1,nan
100,565,100/img/puzzle_100_565.png,"Anthony ciphers words adopting the matrix demonstrated. For instance, the word XGRPA is ciphered as WY UY UA OA US. What word did Anthony cipher WS UZ UY UE US? A: LDVTB,B: ABYSE,C: WIGBA,D: KWHOM,E: LAYCD",C,nan,NO_FINAL_ANSWER,nan,100-565-1,nan
100,566,100/img/puzzle_100_566.png,"Rachel encodes words employing the board presented. For an example, the word WIHBO is encoded as LB EC JB DC JC. What word did Rachel encode JQ LZ TF EF TQ? A: JOMSC,B: TMFJX,C: TMFJX,D: GCAEU,E: XIUPT",B,nan,NO_FINAL_ANSWER,nan,100-566-1,nan
100,567,100/img/puzzle_100_567.png,"William encodes words with the lattice depicted. For instance, the word JOT is encoded as LU TK TN. What word did William encode TU ON OK? A: QJX,B: HGM,C: RTW,D: YWI,E: HGM",B,nan,NO_FINAL_ANSWER,nan,100-567-1,nan
100,568,100/img/puzzle_100_568.png,"Frank conceals words adopting the grid displayed. For an example, the word TVXAI is concealed as VS GH QK ND QH. What word did Frank conceal QS VD QD QK NH? A: QGWXH,B: XBYJS,C: BVTPR,D: RMYIL,E: GJIKS",A,nan,NO_FINAL_ANSWER,nan,100-568-1,nan
100,569,100/img/puzzle_100_569.png,"Wayne encodes words using the matrix shown. For an illustration, the word WCGO is encoded as HU SB HC LC. What word did Wayne encode LU YC LB HB? A: ELNM,B: DEWA,C: GMNO,D: ENML,E: YFJG",A,nan,NO_FINAL_ANSWER,nan,100-569-1,nan
100,570,100/img/puzzle_100_570.png,"Carrie represents words as the lattice shown. For instance, the word VCAYE is represented as BV BF CK LS AV. What word did Carrie represent BS BK TV CK LV? A: SWUDM,B: FLSQA,C: WDTOH,D: JAMTB,E: JTMAB",E,nan,NO_FINAL_ANSWER,nan,100-570-1,nan
100,571,100/img/puzzle_100_571.png,"Kenneth represents words as the grid shown. For instance, the word FCJE is represented as MK UK AX ZX. What word did Kenneth represent ZG MX UX MN? A: HTUA,B: QAGJ,C: TOWI,D: KPUD,E: KUPD",D,nan,NO_FINAL_ANSWER,nan,100-571-1,nan
100,572,100/img/puzzle_100_572.png,"Jon conceals words employing the grid demonstrated. For an example, the word JKMUF is concealed as MS MR MZ IJ DN. What word did Jon conceal DS MN IN WN IZ? A: MNHIP,B: PUVEA,C: GDAVE,D: GRAHE,E: VXQBG",C,nan,NO_FINAL_ANSWER,nan,100-572-1,nan
