puzzle_id,sub_puzzle_id,image_path,origin_question,true_answer,sub_question,answer,level,sub_question_id,subquestion_image_path
100,1520,100/img/puzzle_100_1520.png,"Jon encodes words employing the board presented. For example, the word ALJS is encoded as PC XD XC XI. What word did Jon encode YD FB FD XI? A: QBDW,B: JWAB,C: FUPS,D: FPSU,E: BUKA",C,nan,NO_FINAL_ANSWER,nan,100-1520-1,nan
100,1521,100/img/puzzle_100_1521.png,"Katherine represents words adopting the matrix shown. For instance, the word BTNID is represented as FY TY GN DY BC. What word did Katherine represent BJ DI GJ GN FY? A: WEJGV,B: YGWNB,C: QYPAX,D: YGBNW,E: NFASK",B,nan,NO_FINAL_ANSWER,nan,100-1521-1,nan
100,1522,100/img/puzzle_100_1522.png,"Lisa ciphers words with the matrix demonstrated. For instance, the word EDUI is ciphered as BS RG BG RA. What word did Lisa cipher OJ BJ BA DG? A: GWKV,B: AKVC,C: ACVK,D: MQDN,E: DHYF",B,nan,NO_FINAL_ANSWER,nan,100-1522-1,nan
100,1523,100/img/puzzle_100_1523.png,"Kathryn encodes words applying the grid displayed. For example, the word EHKX is encoded as FI NV JB FB. What word did Kathryn encode JV MV JB JL? A: BRKU,B: TPJO,C: PKBY,D: VOUC,E: MAHC",A,nan,NO_FINAL_ANSWER,nan,100-1523-1,nan
100,1524,100/img/puzzle_100_1524.png,"Lisa ciphers words as the matrix presented. For an example, the word ESADQ is ciphered as JP LP FT ED WO. What word did Lisa cipher JP FO FN EN JO? A: ETCNX,B: HPUOT,C: QVILR,D: ETXCN,E: EPJBA",A,nan,NO_FINAL_ANSWER,nan,100-1524-1,nan
100,1525,100/img/puzzle_100_1525.png,"Matthew encodes words using the lattice demonstrated. For example, the word BXJ is encoded as LY LX VN. What word did Matthew encode CY VY VX? A: PJD,B: DMF,C: DFM,D: PIH,E: CNI",C,nan,NO_FINAL_ANSWER,nan,100-1525-1,nan
100,1526,100/img/puzzle_100_1526.png,"Ariel conceals words employing the matrix depicted. For instance, the word MWD is concealed as WO TO XQ. What word did Ariel conceal XB XO XQ? A: GFS,B: EDJ,C: CRX,D: ICD,E: UXE",D,nan,NO_FINAL_ANSWER,nan,100-1526-1,nan
100,1527,100/img/puzzle_100_1527.png,"Tracy represents words as the grid demonstrated. For instance, the word HJPD is represented as BI TI TQ XK. What word did Tracy represent BI TI PQ XL? A: HJKU,B: EOHN,C: GIQY,D: THFS,E: VJID",A,nan,NO_FINAL_ANSWER,nan,100-1527-1,nan
100,1528,100/img/puzzle_100_1528.png,"Holly represents words employing the lattice displayed. For instance, the word SACI is represented as XJ MF MV XE. What word did Holly represent OF MF OJ OE? A: LWHG,B: POIX,C: TAKQ,D: VPUG,E: TGXQ",C,nan,NO_FINAL_ANSWER,nan,100-1528-1,nan
100,1529,100/img/puzzle_100_1529.png,"Rachel encrypts words applying the grid presented. For an example, the word TVR is encrypyed as WR HE WZ. What word did Rachel encrypt WE OR OZ? A: NAK,B: YJQ,C: BJV,D: DAY,E: YJQ",B,nan,NO_FINAL_ANSWER,nan,100-1529-1,nan
100,1530,100/img/puzzle_100_1530.png,"Karen encrypts words applying the lattice depicted. For an illustration, the word UNKES is encrypyed as RU RG XB AZ AU. What word did Karen encrypt PG AU XG RG PS? A: LCNVS,B: DQXIR,C: FQAGL,D: ASQNV,E: CEQYI",D,nan,NO_FINAL_ANSWER,nan,100-1530-1,nan
100,1531,100/img/puzzle_100_1531.png,"Michael encodes words applying the matrix pictured. For an illustration, the word JPU is encoded as DE LE HE. What word did Michael encode LW LY HW? A: ETO,B: YFG,C: QLO,D: TSD,E: QLO",C,nan,NO_FINAL_ANSWER,nan,100-1531-1,nan
100,1532,100/img/puzzle_100_1532.png,"Rachel represents words applying the grid presented. For example, the word WPA is represented as MX NJ BJ. What word did Rachel represent BX MX NU? A: HWT,B: VBE,C: HTW,D: RTS,E: RVL",A,nan,NO_FINAL_ANSWER,nan,100-1532-1,nan
100,1533,100/img/puzzle_100_1533.png,"Nathan conceals words applying the lattice demonstrated. For example, the word GRPHV is concealed as VF AJ AF OJ PJ. What word did Nathan conceal EF OC OB VF VJ? A: IQLUN,B: KGDNF,C: TDBJU,D: TQAPJ,E: TMUGE",E,nan,NO_FINAL_ANSWER,nan,100-1533-1,nan
100,1534,100/img/puzzle_100_1534.png,"Carrie conceals words as the matrix presented. For instance, the word JENWS is concealed as VO UO JM IB VF. What word did Carrie conceal UM VM JM IB JO? A: YTBGR,B: MYKBA,C: VTNWQ,D: VTNWQ,E: WHTGP",C,nan,NO_FINAL_ANSWER,nan,100-1534-1,nan
100,1535,100/img/puzzle_100_1535.png,"Kristin encrypts words using the grid presented. For an example, the word RPCKH is encrypyed as AD OH GZ GD ON. What word did Kristin encrypt AN LH AH LZ OT? A: RKATU,B: IVEAJ,C: FHOND,D: IEVJA,E: IMOPJ",D,nan,NO_FINAL_ANSWER,nan,100-1535-1,nan
100,1536,100/img/puzzle_100_1536.png,"Brian represents words applying the matrix demonstrated. For an illustration, the word MNAK is represented as NO NX AO BM. What word did Brian represent YO AX NC AC? A: WTFU,B: EYQL,C: WUTF,D: SRVE,E: SMTN",A,nan,NO_FINAL_ANSWER,nan,100-1536-1,nan
100,1537,100/img/puzzle_100_1537.png,"Vickie encodes words with the grid presented. For an example, the word TALW is encoded as FQ FL FE HU. What word did Vickie encode FU JL JU HE? A: KRON,B: VRCQ,C: RSED,D: QLVW,E: YFTB",A,nan,NO_FINAL_ANSWER,nan,100-1537-1,nan
100,1538,100/img/puzzle_100_1538.png,"Sylvia encrypts words applying the lattice demonstrated. For an example, the word BXDO is encrypyed as VA PA GX VX. What word did Sylvia encrypt VB PA PX PB? A: LBFW,B: ARKE,C: XGPF,D: CXLY,E: CXYL",E,nan,NO_FINAL_ANSWER,nan,100-1538-1,nan
100,1539,100/img/puzzle_100_1539.png,"Victor ciphers words as the grid demonstrated. For an illustration, the word IRAQC is ciphered as BA OA NA OZ NW. What word did Victor cipher NZ NA GZ GA BW? A: VAQUS,B: NAMYB,C: NMBYA,D: VBYME,E: RAJBI",B,nan,NO_FINAL_ANSWER,nan,100-1539-1,nan
100,1540,100/img/puzzle_100_1540.png,"Gina encodes words applying the grid shown. For instance, the word PYLO is encoded as PR ER JQ PQ. What word did Gina encode SR SF EQ JR? A: VDTO,B: FEMK,C: WCFD,D: YFXQ,E: WFDC",C,nan,NO_FINAL_ANSWER,nan,100-1540-1,nan
100,1541,100/img/puzzle_100_1541.png,"Joseph conceals words using the lattice depicted. For example, the word AYTG is concealed as QD QX ED GX. What word did Joseph conceal QC GD GX EX? A: FBGO,B: FOGB,C: OEPG,D: JOWE,E: SCQA",A,nan,NO_FINAL_ANSWER,nan,100-1541-1,nan
100,1542,100/img/puzzle_100_1542.png,"Julie encodes words applying the board presented. For instance, the word LIM is encoded as JV AI AY. What word did Julie encode FV AV JI? A: VIR,B: GCA,C: CSG,D: OLB,E: GCA",B,nan,NO_FINAL_ANSWER,nan,100-1542-1,nan
100,1543,100/img/puzzle_100_1543.png,"Charles encodes words as the grid displayed. For an example, the word GNVC is encoded as GN ER GF QB. What word did Charles encode EN YF GB QR? A: HTMD,B: QCLB,C: HTMD,D: IUTE,E: BQLP",A,nan,NO_FINAL_ANSWER,nan,100-1543-1,nan
100,1544,100/img/puzzle_100_1544.png,"Amber conceals words using the board depicted. For example, the word ALXJ is concealed as CG SG SK FY. What word did Amber conceal IG IY CK IL? A: UNDR,B: WGTS,C: BWHL,D: DKBC,E: WGST",B,nan,NO_FINAL_ANSWER,nan,100-1544-1,nan
100,1545,100/img/puzzle_100_1545.png,"Brenda encrypts words applying the board shown. For an example, the word NGFMW is encrypyed as EP ZK NP UR ZR. What word did Brenda encrypt NP ZL CK ZP CQ? A: FORPB,B: UEHRP,C: PSNFQ,D: FORBP,E: VEBQW",A,nan,NO_FINAL_ANSWER,nan,100-1545-1,nan
100,1546,100/img/puzzle_100_1546.png,"Stephen encrypts words using the lattice pictured. For instance, the word OLG is encrypyed as ZW YS YW. What word did Stephen encrypt ZC IC ZS? A: DSB,B: ADP,C: PGY,D: DSB,E: OBJ",A,nan,NO_FINAL_ANSWER,nan,100-1546-1,nan
100,1547,100/img/puzzle_100_1547.png,"Sandra represents words using the matrix depicted. For example, the word UOVDR is represented as GI OX OI KX GU. What word did Sandra represent HI OM HU GI KX? A: PGKIM,B: PFTSH,C: SLIUD,D: WXSUO,E: PRDCN",C,nan,NO_FINAL_ANSWER,nan,100-1547-1,nan
100,1548,100/img/puzzle_100_1548.png,"Amy represents words adopting the matrix depicted. For an example, the word YKUQ is represented as AX AF EX CX. What word did Amy represent EX EF GY GX? A: TIKF,B: ULTO,C: HKGA,D: NSEA,E: UTLO",B,nan,NO_FINAL_ANSWER,nan,100-1548-1,nan
100,1549,100/img/puzzle_100_1549.png,"Charles encrypts words with the grid pictured. For example, the word SIX is encrypyed as CQ WU KZ. What word did Charles encrypt CZ WQ WZ? A: UDH,B: IPF,C: OMD,D: EKW,E: WCT",C,nan,NO_FINAL_ANSWER,nan,100-1549-1,nan
100,1550,100/img/puzzle_100_1550.png,"Michael represents words employing the board presented. For an example, the word LGN is represented as BG TV TG. What word did Michael represent ZG BV TA? A: YMC,B: YMC,C: TVE,D: CFD,E: AUI",A,nan,NO_FINAL_ANSWER,nan,100-1550-1,nan
100,1551,100/img/puzzle_100_1551.png,"Robert ciphers words with the matrix depicted. For an illustration, the word NHTQ is ciphered as GF WU DU DI. What word did Robert cipher GU LU LI GF? A: FGLM,B: SVAH,C: ICJN,D: BMYJ,E: FNEQ",C,nan,NO_FINAL_ANSWER,nan,100-1551-1,nan
100,1552,100/img/puzzle_100_1552.png,"John encrypts words as the board shown. For instance, the word UXM is encrypyed as AQ SF SB. What word did John encrypt MF SB AF? A: JGF,B: VMI,C: MWV,D: APJ,E: VMI",B,nan,NO_FINAL_ANSWER,nan,100-1552-1,nan
100,1553,100/img/puzzle_100_1553.png,"Kristin encrypts words as the grid displayed. For an example, the word XRMD is encrypyed as WA DE PA WU. What word did Kristin encrypt PE ME MC WE? A: CHTE,B: KGOU,C: TLRS,D: WQSD,E: KGUO",E,nan,NO_FINAL_ANSWER,nan,100-1553-1,nan
100,1554,100/img/puzzle_100_1554.png,"Charles encrypts words as the board demonstrated. For an example, the word PHG is encrypyed as KX KD FT. What word did Charles encrypt KX FX QX? A: LIT,B: GMT,C: BCX,D: UDM,E: PFT",E,nan,NO_FINAL_ANSWER,nan,100-1554-1,nan
100,1555,100/img/puzzle_100_1555.png,"William encodes words employing the grid presented. For an example, the word NQTMD is encoded as MG MA UA MN TF. What word did William encode LN TG MP MG HN? A: ABWHG,B: KGXWY,C: BGNAF,D: SXNTV,E: BGFNA",E,nan,NO_FINAL_ANSWER,nan,100-1555-1,nan
100,1556,100/img/puzzle_100_1556.png,"Michele conceals words as the grid pictured. For example, the word WOSYD is concealed as NY FO RX IO RY. What word did Michele conceal FY UG NG NY UT? A: WHLNY,B: MGAIW,C: MAIWG,D: EGBAQ,E: DBUAV",C,nan,NO_FINAL_ANSWER,nan,100-1556-1,nan
100,1557,100/img/puzzle_100_1557.png,"Julie represents words adopting the board pictured. For an illustration, the word SBCMH is represented as UE UH UN QL IE. What word did Julie represent QH YN IO QO YH? A: BKHCU,B: VEXTK,C: UTJXV,D: VLFSD,E: VEKXT",B,nan,NO_FINAL_ANSWER,nan,100-1557-1,nan
100,1558,100/img/puzzle_100_1558.png,"William conceals words adopting the matrix shown. For an illustration, the word LSOXC is concealed as WB UJ PZ PJ VZ. What word did William conceal VG UG PJ PZ WZ? A: GPTOS,B: QCIBL,C: XQABJ,D: XECHY,E: RGXOF",E,nan,NO_FINAL_ANSWER,nan,100-1558-1,nan
100,1559,100/img/puzzle_100_1559.png,"Lisa ciphers words employing the matrix shown. For an example, the word OLCU is ciphered as TZ QE TA TK. What word did Lisa cipher TK QZ GK GZ? A: JAFE,B: UXAK,C: NKJG,D: AWUT,E: RTGD",B,nan,NO_FINAL_ANSWER,nan,100-1559-1,nan
100,1560,100/img/puzzle_100_1560.png,"Christine encodes words employing the grid displayed. For example, the word UIDVN is encoded as WY ET MI WT WA. What word did Christine encode EL HA ET ML WI? A: UCAQV,B: PINLA,C: BJFIS,D: BJIFS,E: GBMXU",D,nan,NO_FINAL_ANSWER,nan,100-1560-1,nan
100,1561,100/img/puzzle_100_1561.png,"Stephen conceals words applying the matrix presented. For instance, the word KQJ is concealed as IG IB JQ. What word did Stephen conceal JB IQ SQ? A: CYP,B: QDM,C: RKE,D: CPY,E: OYU",A,nan,NO_FINAL_ANSWER,nan,100-1561-1,nan
100,1562,100/img/puzzle_100_1562.png,"Melissa encodes words adopting the grid pictured. For an example, the word QMIA is encoded as UV EK TV RK. What word did Melissa encode TH TK EH EV? A: LYSH,B: PBQT,C: YHGB,D: YHBG,E: FGRN",C,nan,NO_FINAL_ANSWER,nan,100-1562-1,nan
100,1563,100/img/puzzle_100_1563.png,"Sandra encrypts words employing the board demonstrated. For an example, the word WTGL is encrypyed as EI QI QW JW. What word did Sandra encrypt EW JR HR QW? A: EOWU,B: LOEJ,C: LDYC,D: BSEG,E: BGSE",D,nan,NO_FINAL_ANSWER,nan,100-1563-1,nan
100,1564,100/img/puzzle_100_1564.png,"Frank conceals words applying the board shown. For instance, the word FRXLN is concealed as UO XI UW XK ZI. What word did Frank conceal ZK XK ZW NK UO? A: KLVHF,B: LKEAU,C: CNJTF,D: KLFHV,E: YILOE",A,nan,NO_FINAL_ANSWER,nan,100-1564-1,nan
100,1565,100/img/puzzle_100_1565.png,"Hannah ciphers words adopting the matrix pictured. For example, the word TCKSJ is ciphered as GJ AF CF WF CY. What word did Hannah cipher AQ PJ CY WJ PF? A: HKGYX,B: FPEUX,C: LJMXN,D: QWRPF,E: LXJNM",E,nan,NO_FINAL_ANSWER,nan,100-1565-1,nan
100,1566,100/img/puzzle_100_1566.png,"Joshua conceals words using the grid pictured. For an illustration, the word QNKDH is concealed as LY IT GT LT IF. What word did Joshua conceal MF IY LF NY ID? A: XVJRT,B: XOWBF,C: JOQWD,D: FAIOB,E: XJVTR",E,nan,NO_FINAL_ANSWER,nan,100-1566-1,nan
100,1567,100/img/puzzle_100_1567.png,"Jasmine conceals words as the matrix demonstrated. For an example, the word KTLS is concealed as TU TR VF MR. What word did Jasmine conceal MF QJ MJ QU? A: CEON,B: ERHW,C: BIFK,D: INAE,E: FNEU",B,nan,NO_FINAL_ANSWER,nan,100-1567-1,nan
100,1568,100/img/puzzle_100_1568.png,"Sandra conceals words with the board displayed. For example, the word EFG is concealed as KZ LZ JZ. What word did Sandra conceal LP LC JP? A: VQU,B: HFQ,C: MRK,D: HYL,E: VUQ",A,nan,NO_FINAL_ANSWER,nan,100-1568-1,nan
100,1569,100/img/puzzle_100_1569.png,"Amber ciphers words using the lattice pictured. For an illustration, the word CHSR is ciphered as IF VS OW IS. What word did Amber cipher OD VD IS OS? A: NDRE,B: PVRU,C: HQTI,D: NLTM,E: KLTF",B,nan,NO_FINAL_ANSWER,nan,100-1569-1,nan
100,1570,100/img/puzzle_100_1570.png,"Melissa ciphers words as the matrix depicted. For instance, the word JNT is ciphered as JZ EM YF. What word did Melissa cipher EZ JM YM? A: WHQ,B: WHQ,C: BKI,D: GUX,E: QNW",A,nan,NO_FINAL_ANSWER,nan,100-1570-1,nan
100,1571,100/img/puzzle_100_1571.png,"William encrypts words applying the grid depicted. For an example, the word HOWPL is encrypyed as TZ XI XR TR DR. What word did William encrypt TZ XZ XI TR DZ? A: IEROM,B: HQOPT,C: RUAXC,D: SQXBI,E: APDMC",B,nan,NO_FINAL_ANSWER,nan,100-1571-1,nan
100,1572,100/img/puzzle_100_1572.png,"Julie ciphers words using the matrix demonstrated. For an illustration, the word XQETK is ciphered as ZY CK GR VR VK. What word did Julie cipher PM CY CK GE VR? A: SYOFL,B: IBQST,C: OHIQN,D: ADBKI,E: EYTDU",B,nan,NO_FINAL_ANSWER,nan,100-1572-1,nan
100,1573,100/img/puzzle_100_1573.png,"Joseph conceals words applying the grid displayed. For an illustration, the word CHIRL is concealed as WA WS WF DA VL. What word did Joseph conceal VS ZF MS WS DQ? A: HGSAW,B: TDEWH,C: KLXHT,D: TSYIF,E: TDWHE",E,nan,NO_FINAL_ANSWER,nan,100-1573-1,nan
100,1574,100/img/puzzle_100_1574.png,"Tina encodes words as the lattice displayed. For instance, the word QHULR is encoded as RY IV FV FK FY. What word did Tina encode IK ZW ZP FW IP? A: VYIWP,B: COTBD,C: CTDOB,D: PXWDE,E: AMDON",B,nan,NO_FINAL_ANSWER,nan,100-1574-1,nan
100,1575,100/img/puzzle_100_1575.png,"Derrick encodes words as the grid presented. For example, the word BXMHU is encoded as UT XT FQ FT KT. What word did Derrick encode XT CO XO FQ UO? A: KVWJD,B: XVYRM,C: XRYMV,D: IAJED,E: QCPKO",C,nan,NO_FINAL_ANSWER,nan,100-1575-1,nan
100,1576,100/img/puzzle_100_1576.png,"Jon encodes words employing the lattice depicted. For an illustration, the word WHLOC is encoded as MH BJ UG BG FK. What word did Jon encode BG UO UJ UG FK? A: XDKVR,B: OQPLC,C: HUERM,D: OCQLP,E: RPYSN",B,nan,NO_FINAL_ANSWER,nan,100-1576-1,nan
100,1577,100/img/puzzle_100_1577.png,"Joseph conceals words with the grid depicted. For example, the word RYDQV is concealed as PT ST SO PO PC. What word did Joseph conceal SV AV PV PC AE? A: JUXVC,B: JVUXC,C: EJXTM,D: BJKUE,E: DFWHE",A,nan,NO_FINAL_ANSWER,nan,100-1577-1,nan
100,1578,100/img/puzzle_100_1578.png,"Lisa encrypts words applying the board presented. For example, the word NXRB is encrypyed as ED NC PG PC. What word did Lisa encrypt SC EC ER NG? A: SITG,B: JMQS,C: PWHE,D: WGAL,E: AQED",B,nan,NO_FINAL_ANSWER,nan,100-1578-1,nan
100,1579,100/img/puzzle_100_1579.png,"Michelle ciphers words as the board displayed. For an example, the word SOHD is ciphered as OJ HB GJ GA. What word did Michelle cipher TB HJ HP GP? A: PURT,B: EUXJ,C: BJQU,D: PRTU,E: CADP",D,nan,NO_FINAL_ANSWER,nan,100-1579-1,nan
100,1580,100/img/puzzle_100_1580.png,"Karen encodes words with the board demonstrated. For an illustration, the word ERQC is encoded as HA MX HX MD. What word did Karen encode MX QT QD HA? A: FXLN,B: RFVE,C: MIYH,D: EXDU,E: RVEF",B,nan,NO_FINAL_ANSWER,nan,100-1580-1,nan
100,1581,100/img/puzzle_100_1581.png,"William encodes words using the grid displayed. For example, the word DWTJ is encoded as XI LI JZ LZ. What word did William encode XE LE HE HO? A: PVSC,B: QYUA,C: KHYD,D: PVSC,E: DEFV",A,nan,NO_FINAL_ANSWER,nan,100-1581-1,nan
100,1582,100/img/puzzle_100_1582.png,"Nathan ciphers words employing the board depicted. For instance, the word YCS is ciphered as TG EX EG. What word did Nathan cipher EM IG TM? A: MDE,B: LFR,C: LRF,D: CID,E: DFR",C,nan,NO_FINAL_ANSWER,nan,100-1582-1,nan
100,1583,100/img/puzzle_100_1583.png,"Melissa conceals words using the lattice pictured. For an example, the word EIAQT is concealed as DN UC QZ DC QC. What word did Melissa conceal QH UC DC QC UH? A: QSWDU,B: SIQTM,C: IPHWT,D: WOFMB,E: OPRLJ",B,nan,NO_FINAL_ANSWER,nan,100-1583-1,nan
100,1584,100/img/puzzle_100_1584.png,"Robert encodes words applying the board presented. For an illustration, the word HXTCM is encoded as LO WO LX UO SA. What word did Robert encode WX WI VI VX VA? A: JCSHF,B: GHWOR,C: XKFQU,D: AEUMT,E: PAJBG",E,nan,NO_FINAL_ANSWER,nan,100-1584-1,nan
100,1585,100/img/puzzle_100_1585.png,"Joseph encrypts words applying the grid depicted. For an example, the word FPQ is encrypyed as YE HE VE. What word did Joseph encrypt HT VM YM? A: UJC,B: KCX,C: FNS,D: UJC,E: XPY",A,nan,NO_FINAL_ANSWER,nan,100-1585-1,nan
100,1586,100/img/puzzle_100_1586.png,"Cristina encrypts words applying the grid demonstrated. For an example, the word MSOI is encrypyed as WY FO JO NY. What word did Cristina encrypt JY JO JD FC? A: DNXO,B: TYXS,C: ERFV,D: CSDG,E: DONX",E,nan,NO_FINAL_ANSWER,nan,100-1586-1,nan
100,1587,100/img/puzzle_100_1587.png,"Amber encodes words using the lattice demonstrated. For an illustration, the word JVSB is encoded as SO HO HX SC. What word did Amber encode HC UX UO HX? A: YRTV,B: CSDY,C: DGOS,D: EPFL,E: DGOS",C,nan,NO_FINAL_ANSWER,nan,100-1587-1,nan
100,1588,100/img/puzzle_100_1588.png,"Jon conceals words adopting the matrix demonstrated. For instance, the word WMJ is concealed as QX YE YX. What word did Jon conceal DX QE QM? A: KTP,B: SIF,C: BDC,D: BDC,E: FET",C,nan,NO_FINAL_ANSWER,nan,100-1588-1,nan
100,1589,100/img/puzzle_100_1589.png,"Rebecca encodes words employing the board displayed. For an illustration, the word HUENF is encoded as ZC YE QF MC QR. What word did Rebecca encode ZC QC YR MR ME? A: BKFDE,B: HMKWQ,C: HMKQW,D: APMGH,E: XKALJ",B,nan,NO_FINAL_ANSWER,nan,100-1589-1,nan
100,1590,100/img/puzzle_100_1590.png,"Pamela encodes words adopting the grid shown. For an illustration, the word GFC is encoded as OK VK VF. What word did Pamela encode WT VT WK? A: OAB,B: ERB,C: AIR,D: ERB,E: BPE",B,nan,NO_FINAL_ANSWER,nan,100-1590-1,nan
100,1591,100/img/puzzle_100_1591.png,"Matthew represents words with the grid depicted. For example, the word KOG is represented as JL UL JG. What word did Matthew represent UM UG JL? A: UPK,B: GYR,C: TKI,D: KCH,E: UPK",A,nan,NO_FINAL_ANSWER,nan,100-1591-1,nan
100,1592,100/img/puzzle_100_1592.png,"Anthony ciphers words as the lattice demonstrated. For an example, the word EBYOJ is ciphered as NX FR GR GP LD. What word did Anthony cipher JU FX LX GR NR? A: LFETG,B: HDVYK,C: GCKFJ,D: FPGXA,E: FAIPD",B,nan,NO_FINAL_ANSWER,nan,100-1592-1,nan
100,1593,100/img/puzzle_100_1593.png,"Brenda ciphers words as the board shown. For example, the word PUYS is ciphered as WH ZM KH KM. What word did Brenda cipher ZA RA WA WH? A: XHQJ,B: HPDJ,C: CXIF,D: HDJP,E: HNRA",D,nan,NO_FINAL_ANSWER,nan,100-1593-1,nan
100,1594,100/img/puzzle_100_1594.png,"Jeff ciphers words applying the lattice presented. For an illustration, the word XFTN is ciphered as ZP KJ ZW DJ. What word did Jeff cipher AJ AV DV KP? A: KLXS,B: UPSK,C: USPK,D: QPSH,E: HRPO",B,nan,NO_FINAL_ANSWER,nan,100-1594-1,nan
100,1595,100/img/puzzle_100_1595.png,"Justin conceals words applying the lattice presented. For example, the word XLYU is concealed as FV ZP QM ZM. What word did Justin conceal QV RM ZM FP? A: LMGR,B: NOKT,C: RUPF,D: JUEP,E: JPUE",E,nan,NO_FINAL_ANSWER,nan,100-1595-1,nan
100,1596,100/img/puzzle_100_1596.png,"Johnny represents words adopting the lattice displayed. For example, the word ASQTU is represented as GF GA KQ IA IF. What word did Johnny represent DA IP KP GE IF? A: PYJXL,B: EVUFN,C: ENVFU,D: XOVQR,E: XVTAH",C,nan,NO_FINAL_ANSWER,nan,100-1596-1,nan
100,1597,100/img/puzzle_100_1597.png,"Anthony encodes words applying the lattice pictured. For an illustration, the word XBIY is encoded as FS GH GS MS. What word did Anthony encode MH MK GR GH? A: EBQA,B: VFPY,C: AGRM,D: DVAN,E: EQAB",E,nan,NO_FINAL_ANSWER,nan,100-1597-1,nan
100,1598,100/img/puzzle_100_1598.png,"Joseph conceals words as the grid depicted. For example, the word SIP is concealed as DJ DC RT. What word did Joseph conceal ST RT RJ? A: ETW,B: NPO,C: WMU,D: YJV,E: NPO",B,nan,NO_FINAL_ANSWER,nan,100-1598-1,nan
100,1599,100/img/puzzle_100_1599.png,"Charles encrypts words employing the grid presented. For example, the word VLCFS is encrypyed as DJ AL EL OJ OW. What word did Charles encrypt EW OR DR ER AH? A: MDLCJ,B: TSIGL,C: NSLQD,D: TGYBV,E: WBTMP",E,nan,NO_FINAL_ANSWER,nan,100-1599-1,nan
100,1600,100/img/puzzle_100_1600.png,"Charles ciphers words as the grid displayed. For an illustration, the word LTB is ciphered as QH CE GH. What word did Charles cipher CH QE CU? A: HSI,B: RIA,C: TDH,D: NWK,E: RAI",B,nan,NO_FINAL_ANSWER,nan,100-1600-1,nan
100,1601,100/img/puzzle_100_1601.png,"Nicholas ciphers words applying the board pictured. For instance, the word TAV is ciphered as NV KV NO. What word did Nicholas cipher AD AO KD? A: DVN,B: RSQ,C: RSQ,D: PTR,E: SOA",B,nan,NO_FINAL_ANSWER,nan,100-1601-1,nan
100,1602,100/img/puzzle_100_1602.png,"Felicia represents words applying the lattice pictured. For an illustration, the word EHQPF is represented as GC RI GI RY UI. What word did Felicia represent GY UY RZ UC EZ? A: MXBQP,B: CNEXM,C: NMOWT,D: XBVYC,E: XBCYV",D,nan,NO_FINAL_ANSWER,nan,100-1602-1,nan
100,1603,100/img/puzzle_100_1603.png,"Paul ciphers words applying the lattice demonstrated. For example, the word IDC is ciphered as FI TV AI. What word did Paul cipher TI AQ FV? A: NXK,B: AGF,C: HRP,D: BWR,E: NKX",E,nan,NO_FINAL_ANSWER,nan,100-1603-1,nan
100,1604,100/img/puzzle_100_1604.png,"Michele encodes words employing the grid displayed. For an example, the word YEX is encoded as QU IU IH. What word did Michele encode FL IH FU? A: IWQ,B: OXY,C: UXT,D: XIU,E: HQE",C,nan,NO_FINAL_ANSWER,nan,100-1604-1,nan
100,1605,100/img/puzzle_100_1605.png,"Danielle conceals words using the grid displayed. For instance, the word UDWF is concealed as WT NO UV CV. What word did Danielle conceal WV UO CT NT? A: QYHB,B: TCEF,C: WMSI,D: LIVB,E: JNCP",A,nan,NO_FINAL_ANSWER,nan,100-1605-1,nan
100,1606,100/img/puzzle_100_1606.png,"Michael encrypts words using the lattice presented. For example, the word LCBY is encrypyed as UD UN UE WN. What word did Michael encrypt WN QN QD WD? A: SAHE,B: YVFM,C: IQND,D: GJMK,E: YMVF",E,nan,NO_FINAL_ANSWER,nan,100-1606-1,nan
100,1607,100/img/puzzle_100_1607.png,"Julie encrypts words using the board presented. For an example, the word KDU is encrypyed as KE KT UM. What word did Julie encrypt KM HT UE? A: RTP,B: ETA,C: LUK,D: RTP,E: TKN",A,nan,NO_FINAL_ANSWER,nan,100-1607-1,nan
100,1608,100/img/puzzle_100_1608.png,"Carrie encodes words as the matrix presented. For an illustration, the word TJW is encoded as ZB XB ZN. What word did Carrie encode WB XO XB? A: IGW,B: DYJ,C: RUQ,D: FDP,E: DYJ",B,nan,NO_FINAL_ANSWER,nan,100-1608-1,nan
100,1609,100/img/puzzle_100_1609.png,"Lisa encrypts words as the lattice depicted. For an illustration, the word TYVKR is encrypyed as QX OM IM FE CX. What word did Lisa encrypt OX FX IL CM QN? A: ILGRU,B: UVAFI,C: NFJMH,D: RADFG,E: NFJHM",C,nan,NO_FINAL_ANSWER,nan,100-1609-1,nan
100,1610,100/img/puzzle_100_1610.png,"John conceals words employing the grid shown. For example, the word NTS is concealed as HR IZ HV. What word did John conceal GV HZ HR? A: PYN,B: COP,C: IEH,D: LHV,E: QCX",A,nan,NO_FINAL_ANSWER,nan,100-1610-1,nan
100,1611,100/img/puzzle_100_1611.png,"Sandra encodes words employing the grid depicted. For example, the word HIBQL is encoded as TD MV CV ED JD. What word did Sandra encode MV TN TD EN EV? A: ICYHM,B: TQAOP,C: LACSU,D: UMNQC,E: ICHMY",E,nan,NO_FINAL_ANSWER,nan,100-1611-1,nan
100,1612,100/img/puzzle_100_1612.png,"John encodes words applying the grid shown. For instance, the word NAFI is encoded as WM DX DZ DM. What word did John encode WX DH EH PZ? A: BYRS,B: VXEA,C: QGWP,D: NOTA,E: BYRS",A,nan,NO_FINAL_ANSWER,nan,100-1612-1,nan
100,1613,100/img/puzzle_100_1613.png,"Rebecca encrypts words adopting the matrix depicted. For instance, the word YUSQE is encrypyed as SW SU ZW DE ZU. What word did Rebecca encrypt ZW DW DR DI DE? A: JKFSU,B: SCQBH,C: QUGIA,D: WLRGY,E: SCBHQ",E,nan,NO_FINAL_ANSWER,nan,100-1613-1,nan
100,1614,100/img/puzzle_100_1614.png,"Derrick conceals words as the board presented. For an illustration, the word LRY is concealed as OS AY OI. What word did Derrick conceal VS VY AI? A: EQO,B: BVQ,C: QBR,D: BQV,E: UDQ",B,nan,NO_FINAL_ANSWER,nan,100-1614-1,nan
