puzzle_id,sub_puzzle_id,image_path,origin_question,true_answer,sub_question,answer,level,sub_question_id,subquestion_image_path
100,955,100/img/puzzle_100_955.png,"Jerry conceals words as the board displayed. For example, the word XWNG is concealed as MK NP MG LK. What word did Jerry conceal LI NI MK HG? A: HNWU,B: AXLO,C: MWYO,D: KJOU,E: AOXL",E,nan,NO_FINAL_ANSWER,nan,100-955-1,nan
100,956,100/img/puzzle_100_956.png,"Paige represents words applying the grid demonstrated. For example, the word BAE is represented as TF WB WF. What word did Paige represent TB IU IF? A: OLS,B: DSY,C: UTW,D: OLS,E: JMX",A,nan,NO_FINAL_ANSWER,nan,100-956-1,nan
100,957,100/img/puzzle_100_957.png,"John conceals words applying the lattice demonstrated. For an illustration, the word NMAIO is concealed as PA YN DA DS PS. What word did John conceal HN PN HA YG YS? A: QKTFB,B: WGNLO,C: MEPJU,D: FROBD,E: TSVYK",E,nan,NO_FINAL_ANSWER,nan,100-957-1,nan
100,958,100/img/puzzle_100_958.png,"Michele represents words adopting the board pictured. For an illustration, the word HWJM is represented as KO FB FM JM. What word did Michele represent KG JO KB JG? A: QMCJ,B: ULEJ,C: NFBD,D: OYTL,E: NFBD",C,nan,NO_FINAL_ANSWER,nan,100-958-1,nan
100,959,100/img/puzzle_100_959.png,"Jeff ciphers words applying the board depicted. For example, the word ESPFU is ciphered as YT NI RI YV DV. What word did Jeff cipher NV YZ BZ YV RV? A: QIFJC,B: KPVMG,C: ROYTW,D: QICFJ,E: IOKDA",D,nan,NO_FINAL_ANSWER,nan,100-959-1,nan
100,960,100/img/puzzle_100_960.png,"Denise represents words applying the grid pictured. For an illustration, the word PFN is represented as BY BX VX. What word did Denise represent ZX VH ZH? A: HLX,B: ULC,C: HLX,D: APM,E: BOR",A,nan,NO_FINAL_ANSWER,nan,100-960-1,nan
100,961,100/img/puzzle_100_961.png,"Chelsea encrypts words employing the grid shown. For an example, the word CTB is encrypyed as WM HD HM. What word did Chelsea encrypt HQ WQ SD? A: VXP,B: IPW,C: CSD,D: BFW,E: IPW",B,nan,NO_FINAL_ANSWER,nan,100-961-1,nan
100,962,100/img/puzzle_100_962.png,"Pamela conceals words using the grid displayed. For an example, the word KTDNB is concealed as UP WJ UJ WP ZY. What word did Pamela conceal WY ZY UH BH ZH? A: QBSLX,B: RUSCM,C: EDQFV,D: VPYJF,E: OYFGP",A,nan,NO_FINAL_ANSWER,nan,100-962-1,nan
100,963,100/img/puzzle_100_963.png,"Deborah encodes words as the grid displayed. For example, the word TJQS is encoded as TL DZ IL QL. What word did Deborah encode DB TC QC IZ? A: AXES,B: EGOR,C: EGOR,D: TSFU,E: ISLP",B,nan,NO_FINAL_ANSWER,nan,100-963-1,nan
100,964,100/img/puzzle_100_964.png,"Victor conceals words applying the matrix pictured. For an example, the word VWJM is concealed as MW YG JF JK. What word did Victor conceal JF MG MF YF? A: DIGR,B: CFTV,C: JPXD,D: CJVX,E: JAWF",C,nan,NO_FINAL_ANSWER,nan,100-964-1,nan
100,965,100/img/puzzle_100_965.png,"Jennifer represents words as the lattice presented. For an illustration, the word PBY is represented as RZ KZ IP. What word did Jennifer represent IW RP IZ? A: RNT,B: KER,C: LCV,D: CWL,E: KRE",E,nan,NO_FINAL_ANSWER,nan,100-965-1,nan
100,966,100/img/puzzle_100_966.png,"Tracy conceals words applying the matrix presented. For instance, the word FKT is concealed as AQ BQ PY. What word did Tracy conceal BM PQ AM? A: OTM,B: JRE,C: OPH,D: IVK,E: OPH",C,nan,NO_FINAL_ANSWER,nan,100-966-1,nan
100,967,100/img/puzzle_100_967.png,"Carl represents words adopting the matrix pictured. For example, the word YIG is represented as PW PR AM. What word did Carl represent AR PM LR? A: VXJ,B: ORI,C: DSY,D: PNL,E: VXJ",A,nan,NO_FINAL_ANSWER,nan,100-967-1,nan
100,968,100/img/puzzle_100_968.png,"Jose ciphers words using the board displayed. For an illustration, the word BASN is ciphered as GV MV GE MR. What word did Jose cipher MX QE QV MV? A: AUWB,B: DNCE,C: MIXA,D: HLEW,E: RYIQ",C,nan,NO_FINAL_ANSWER,nan,100-968-1,nan
100,969,100/img/puzzle_100_969.png,"Natalie ciphers words applying the board shown. For example, the word PNSUK is ciphered as EO EJ AJ AG AP. What word did Natalie cipher DJ EJ DG ES AJ? A: UYLFE,B: VNSID,C: GORES,D: VNIDS,E: YUEJN",D,nan,NO_FINAL_ANSWER,nan,100-969-1,nan
100,970,100/img/puzzle_100_970.png,"Jorge encodes words employing the grid pictured. For example, the word SPI is encoded as GY GX KL. What word did Jorge encode GL GY NY? A: OSG,B: MKW,C: PUC,D: URE,E: OSG",A,nan,NO_FINAL_ANSWER,nan,100-970-1,nan
100,971,100/img/puzzle_100_971.png,"Anthony ciphers words employing the grid pictured. For instance, the word IMD is ciphered as BE QW BW. What word did Anthony cipher QR YE BW? A: OHD,B: LSR,C: LGN,D: BYO,E: SNM",A,nan,NO_FINAL_ANSWER,nan,100-971-1,nan
100,972,100/img/puzzle_100_972.png,"Joseph encrypts words applying the matrix presented. For example, the word WBN is encrypyed as SN EH SF. What word did Joseph encrypt EN SH EH? A: LTB,B: LTB,C: QJR,D: QNG,E: KRG",A,nan,NO_FINAL_ANSWER,nan,100-972-1,nan
100,973,100/img/puzzle_100_973.png,"Carrie conceals words employing the lattice depicted. For an illustration, the word LIVEW is concealed as BQ OE HJ LJ BG. What word did Carrie conceal OW HG OG SE LW? A: SQLUG,B: MSGCO,C: EMGVS,D: FMKDJ,E: RTPSO",B,nan,NO_FINAL_ANSWER,nan,100-973-1,nan
100,974,100/img/puzzle_100_974.png,"Gina encrypts words as the matrix depicted. For instance, the word FMNXE is encrypyed as MI MV KB UV NY. What word did Gina encrypt UY NJ MJ NI NV? A: HEFVI,B: IWUQA,C: VXTOE,D: TIOUK,E: IWQUA",E,nan,NO_FINAL_ANSWER,nan,100-974-1,nan
100,975,100/img/puzzle_100_975.png,"Jorge represents words with the matrix depicted. For example, the word WAVK is represented as MX MB MN PB. What word did Jorge represent PG FX WG WN? A: JXLR,B: JXRL,C: UFNH,D: PLYT,E: XWSY",A,nan,NO_FINAL_ANSWER,nan,100-975-1,nan
100,976,100/img/puzzle_100_976.png,"Thomas represents words applying the lattice pictured. For an illustration, the word OHTBU is represented as FQ DQ UR IJ VR. What word did Thomas represent DR UW IR DJ VW? A: SVCDG,B: DKFBU,C: JKXPL,D: MUJTG,E: SVCGD",E,nan,NO_FINAL_ANSWER,nan,100-976-1,nan
100,977,100/img/puzzle_100_977.png,"Anthony encrypts words applying the board displayed. For an example, the word KRX is encrypyed as HX FX SX. What word did Anthony encrypt FZ HZ FA? A: TIB,B: CSW,C: UMK,D: XPN,E: DEG",B,nan,NO_FINAL_ANSWER,nan,100-977-1,nan
100,978,100/img/puzzle_100_978.png,"Amber represents words employing the grid presented. For instance, the word QPTV is represented as GN GM KO KL. What word did Amber represent KN VM GL VO? A: MEID,B: IYSJ,C: GKBL,D: ARNF,E: MIDE",A,nan,NO_FINAL_ANSWER,nan,100-978-1,nan
100,979,100/img/puzzle_100_979.png,"Michael encodes words adopting the board demonstrated. For example, the word DRWX is encoded as AB DB AI AG. What word did Michael encode SB TI SM TM? A: ORTG,B: JYWG,C: HTKV,D: XFNA,E: SOQC",E,nan,NO_FINAL_ANSWER,nan,100-979-1,nan
100,980,100/img/puzzle_100_980.png,"Anthony conceals words applying the board presented. For an example, the word LMRWB is concealed as VX HZ CK RL VZ. What word did Anthony conceal VL MK CO CK VO? A: ACRXN,B: KYMXG,C: FNQRG,D: FNGQR,E: GWKCM",C,nan,NO_FINAL_ANSWER,nan,100-980-1,nan
100,981,100/img/puzzle_100_981.png,"Melissa ciphers words using the grid shown. For instance, the word YDL is ciphered as WI UI WO. What word did Melissa cipher WI VO UG? A: YJF,B: VFC,C: NIF,D: WYE,E: BXQ",A,nan,NO_FINAL_ANSWER,nan,100-981-1,nan
100,982,100/img/puzzle_100_982.png,"Rachel ciphers words using the matrix demonstrated. For an illustration, the word DIOP is ciphered as UL EJ UV DV. What word did Rachel cipher DK UV UL EL? A: XODK,B: CTKN,C: XODK,D: ARFL,E: RTNI",A,nan,NO_FINAL_ANSWER,nan,100-982-1,nan
100,983,100/img/puzzle_100_983.png,"Rachel conceals words employing the lattice pictured. For example, the word KSIB is concealed as HR VA HC BR. What word did Rachel conceal LS HA HC HR? A: AEQN,B: QNUI,C: OIMC,D: DWKI,E: DWIK",E,nan,NO_FINAL_ANSWER,nan,100-983-1,nan
100,984,100/img/puzzle_100_984.png,"Crystal encodes words applying the matrix presented. For instance, the word TEB is encoded as VF UF EG. What word did Crystal encode UG EF UL? A: JAE,B: THS,C: XAV,D: ILJ,E: BTD",D,nan,NO_FINAL_ANSWER,nan,100-984-1,nan
100,985,100/img/puzzle_100_985.png,"Erin encrypts words adopting the grid depicted. For an illustration, the word CEO is encrypyed as AP KM DM. What word did Erin encrypt AM DM KC? A: AYR,B: SEO,C: WON,D: BVQ,E: WON",C,nan,NO_FINAL_ANSWER,nan,100-985-1,nan
100,986,100/img/puzzle_100_986.png,"Kathryn encrypts words applying the lattice presented. For an example, the word KTYLS is encrypyed as FK YK AD OD YD. What word did Kathryn encrypt AR AC AD YC YK? A: NOVJE,B: AQPHT,C: POCTY,D: ORJMW,E: PCYOT",E,nan,NO_FINAL_ANSWER,nan,100-986-1,nan
100,987,100/img/puzzle_100_987.png,"Gabriel encrypts words applying the grid depicted. For an example, the word GNTO is encrypyed as KD KN GA KA. What word did Gabriel encrypt GN UN KD UD? A: BDCO,B: YGDE,C: VQTN,D: YTXI,E: YDGE",E,nan,NO_FINAL_ANSWER,nan,100-987-1,nan
100,988,100/img/puzzle_100_988.png,"Joseph encrypts words employing the lattice presented. For an illustration, the word INY is encrypyed as RZ LP RP. What word did Joseph encrypt RP RG RZ? A: JNR,B: LYV,C: BGP,D: HML,E: YCI",E,nan,NO_FINAL_ANSWER,nan,100-988-1,nan
100,989,100/img/puzzle_100_989.png,"Johnny represents words using the lattice demonstrated. For example, the word PKG is represented as IR ZL ZR. What word did Johnny represent KR KF IL? A: WHO,B: QTC,C: WHO,D: QCS,E: PHY",A,nan,NO_FINAL_ANSWER,nan,100-989-1,nan
100,990,100/img/puzzle_100_990.png,"John encrypts words as the grid shown. For an illustration, the word CFEB is encrypyed as UQ ZM JQ EQ. What word did John encrypt ZK JQ ZM EV? A: JGVW,B: KEFP,C: KEFP,D: SVUG,E: DAOF",B,nan,NO_FINAL_ANSWER,nan,100-990-1,nan
100,991,100/img/puzzle_100_991.png,"Danielle conceals words applying the board demonstrated. For an example, the word DYHON is concealed as ZR HK XR ZW SR. What word did Danielle conceal HR HW ZR ZG SK? A: AKQJB,B: VIDGJ,C: UEXND,D: VNJUQ,E: XSMIC",B,nan,NO_FINAL_ANSWER,nan,100-991-1,nan
100,992,100/img/puzzle_100_992.png,"Crystal conceals words employing the grid depicted. For an example, the word VHO is concealed as FB YP FA. What word did Crystal conceal VA VP FA? A: DMG,B: LMO,C: LMO,D: GUI,E: WVQ",B,nan,NO_FINAL_ANSWER,nan,100-992-1,nan
100,993,100/img/puzzle_100_993.png,"Katherine represents words adopting the matrix displayed. For example, the word DAOHK is represented as GU FP MU OR FU. What word did Katherine represent GR FP AZ AH AP? A: WIMCQ,B: QBNMV,C: LAEPG,D: PTVXO,E: LPEAG",C,nan,NO_FINAL_ANSWER,nan,100-993-1,nan
100,994,100/img/puzzle_100_994.png,"Carl ciphers words using the matrix demonstrated. For an example, the word FVK is ciphered as XD EJ TD. What word did Carl cipher TJ ED XC? A: EHQ,B: YOS,C: QMH,D: YOS,E: TNV",B,nan,NO_FINAL_ANSWER,nan,100-994-1,nan
100,995,100/img/puzzle_100_995.png,"Wayne conceals words with the lattice pictured. For an example, the word DSRNW is concealed as HZ WU WZ YX CZ. What word did Wayne conceal QF WP YU CX HF? A: VQGAI,B: VIQAG,C: XWRVB,D: CQJVI,E: ATGCI",A,nan,NO_FINAL_ANSWER,nan,100-995-1,nan
100,996,100/img/puzzle_100_996.png,"Tina conceals words using the lattice presented. For an illustration, the word LKRI is concealed as AR AX KI LI. What word did Tina conceal AR LX KI GX? A: ASNF,B: SVBU,C: UEND,D: OBUH,E: LWRG",E,nan,NO_FINAL_ANSWER,nan,100-996-1,nan
100,997,100/img/puzzle_100_997.png,"Katherine encrypts words adopting the lattice presented. For an example, the word UXSVH is encrypyed as CL CM PW YD GW. What word did Katherine encrypt AM YO CW GO CD? A: NKDEX,B: SYPNO,C: NDCGV,D: TNMKF,E: TMNKF",E,nan,NO_FINAL_ANSWER,nan,100-997-1,nan
100,998,100/img/puzzle_100_998.png,"Justin encrypts words adopting the board pictured. For an example, the word TGBV is encrypyed as LX LG AJ IG. What word did Justin encrypt IJ IW CX LJ? A: PYSF,B: RAJS,C: VABX,D: UWCE,E: INEM",B,nan,NO_FINAL_ANSWER,nan,100-998-1,nan
100,999,100/img/puzzle_100_999.png,"Ariel conceals words employing the lattice depicted. For an illustration, the word PFWK is concealed as HR QZ HZ DX. What word did Ariel conceal HZ DX HX DV? A: KFCV,B: WKXN,C: BEND,D: WCGT,E: GXMT",B,nan,NO_FINAL_ANSWER,nan,100-999-1,nan
100,1000,100/img/puzzle_100_1000.png,"Carrie ciphers words with the matrix shown. For an example, the word HBNLX is ciphered as YP EC YJ YQ WC. What word did Carrie cipher YH YC WJ YP KH? A: CXBYO,B: XVFUN,C: VAFYK,D: YEIKH,E: PMGHT",E,nan,NO_FINAL_ANSWER,nan,100-1000-1,nan
100,1001,100/img/puzzle_100_1001.png,"Katherine ciphers words with the matrix shown. For an illustration, the word YBKTJ is ciphered as FV NZ FP NM FM. What word did Katherine cipher CM FD SD FP FV? A: MYIKF,B: MFIKY,C: CAJTU,D: NTQFB,E: DOAMI",B,nan,NO_FINAL_ANSWER,nan,100-1001-1,nan
100,1002,100/img/puzzle_100_1002.png,"Tyler encrypts words with the grid presented. For an example, the word YPIXM is encrypyed as TV NA ZM JM TX. What word did Tyler encrypt NH LH NX LX ZA? A: VQDTK,B: BGJNM,C: BRKNF,D: WOYAE,E: VDTQK",A,nan,NO_FINAL_ANSWER,nan,100-1002-1,nan
100,1003,100/img/puzzle_100_1003.png,"Carrie represents words applying the lattice presented. For instance, the word OQFX is represented as KA QP KY QZ. What word did Carrie represent UZ KY KA QA? A: IFOT,B: DYSO,C: NVLI,D: CYIW,E: IFTO",A,nan,NO_FINAL_ANSWER,nan,100-1003-1,nan
100,1004,100/img/puzzle_100_1004.png,"Jorge encrypts words using the lattice displayed. For an example, the word CMA is encrypyed as FT LK CK. What word did Jorge encrypt FT LT CR? A: NYK,B: CHB,C: CHB,D: QEO,E: MCG",B,nan,NO_FINAL_ANSWER,nan,100-1004-1,nan
100,1005,100/img/puzzle_100_1005.png,"Amy ciphers words employing the lattice demonstrated. For example, the word TCW is ciphered as NT NP RP. What word did Amy cipher RT MT MA? A: IRY,B: APH,C: YMU,D: IRY,E: IFP",A,nan,NO_FINAL_ANSWER,nan,100-1005-1,nan
100,1006,100/img/puzzle_100_1006.png,"Charles encodes words using the grid displayed. For instance, the word LWGVJ is encoded as LK RD EX SD AD. What word did Charles encode RK AD SX LB LD? A: KRMTW,B: KIJMY,C: UJEYO,D: OIVES,E: UEJYO",C,nan,NO_FINAL_ANSWER,nan,100-1006-1,nan
100,1007,100/img/puzzle_100_1007.png,"Ariel ciphers words using the board displayed. For instance, the word CSU is ciphered as ZJ RM TM. What word did Ariel cipher TB RJ RB? A: RIL,B: RLI,C: LFS,D: BLH,E: OLB",A,nan,NO_FINAL_ANSWER,nan,100-1007-1,nan
100,1008,100/img/puzzle_100_1008.png,"William encodes words applying the matrix demonstrated. For instance, the word LYIM is encoded as DE BJ PM DJ. What word did William encode RM PK PM PE? A: HKIT,B: BGLM,C: IYWN,D: FIQV,E: LAMJ",A,nan,NO_FINAL_ANSWER,nan,100-1008-1,nan
100,1009,100/img/puzzle_100_1009.png,"Charles encodes words with the matrix displayed. For an example, the word ECTU is encoded as RJ PQ CZ TN. What word did Charles encode CN RQ CQ RZ? A: GAJI,B: VPLD,C: DFSQ,D: VLDP,E: SDUR",B,nan,NO_FINAL_ANSWER,nan,100-1009-1,nan
100,1010,100/img/puzzle_100_1010.png,"Cristina encodes words with the grid pictured. For instance, the word XWDGR is encoded as AE AP WP AB WU. What word did Cristina encode WU QE QP QD AU? A: RUPAO,B: IEGVH,C: CPSGA,D: RAPOU,E: IUCDA",A,nan,NO_FINAL_ANSWER,nan,100-1010-1,nan
100,1011,100/img/puzzle_100_1011.png,"Danielle encrypts words adopting the grid depicted. For an illustration, the word PDBJ is encrypyed as PF PT LO NF. What word did Danielle encrypt LF KT NT KU? A: YFRP,B: EMRH,C: KCAE,D: UMHC,E: UMHC",D,nan,NO_FINAL_ANSWER,nan,100-1011-1,nan
100,1012,100/img/puzzle_100_1012.png,"Christopher represents words applying the grid presented. For example, the word RBIG is represented as ZJ YX YT RT. What word did Christopher represent CT CW RT RJ? A: GTCW,B: FSYK,C: NGJM,D: NMGJ,E: QDJW",D,nan,NO_FINAL_ANSWER,nan,100-1012-1,nan
100,1013,100/img/puzzle_100_1013.png,"Jon conceals words employing the board demonstrated. For an example, the word YEVGJ is concealed as EZ JU GQ EQ GZ. What word did Jon conceal PQ EB JZ YB PA? A: USWMD,B: QWCVL,C: MFYUN,D: LPCQK,E: LPKQC",E,nan,NO_FINAL_ANSWER,nan,100-1013-1,nan
100,1014,100/img/puzzle_100_1014.png,"Rachel represents words employing the matrix shown. For an illustration, the word YPFNL is represented as EX AB HX FG VB. What word did Rachel represent FK FC HB EX AB? A: QDUYP,B: OAYGE,C: SVBUG,D: QPYUD,E: FBQKU",A,nan,NO_FINAL_ANSWER,nan,100-1014-1,nan
100,1015,100/img/puzzle_100_1015.png,"Albert ciphers words with the grid depicted. For an example, the word XBJA is ciphered as YQ EJ WM WZ. What word did Albert cipher YQ KQ YJ KM? A: BCAG,B: XUHE,C: YUXF,D: KOBD,E: LEAQ",B,nan,NO_FINAL_ANSWER,nan,100-1015-1,nan
100,1016,100/img/puzzle_100_1016.png,"Chelsea encodes words with the board pictured. For an example, the word JPWR is encoded as WI QN YI YN. What word did Chelsea encode EG YG WI QI? A: YPNS,B: YWXR,C: AXJB,D: TLEB,E: AXJB",C,nan,NO_FINAL_ANSWER,nan,100-1016-1,nan
100,1017,100/img/puzzle_100_1017.png,"Jasmine ciphers words with the lattice shown. For example, the word GVQM is ciphered as SK SG JK OY. What word did Jasmine cipher JG SG CG SK? A: AMVE,B: PATG,C: XVRG,D: XRVG,E: UAPF",C,nan,NO_FINAL_ANSWER,nan,100-1017-1,nan
100,1018,100/img/puzzle_100_1018.png,"Michael represents words applying the board displayed. For instance, the word VSBQ is represented as YN JG YX JX. What word did Michael represent KX YX KN SX? A: JBCO,B: GMDV,C: CJGO,D: KLVJ,E: JOCB",A,nan,NO_FINAL_ANSWER,nan,100-1018-1,nan
100,1019,100/img/puzzle_100_1019.png,"Daniel encodes words adopting the grid depicted. For an example, the word VINOD is encoded as NP YH TH ZC UB. What word did Daniel encode YC NB YH UH UB? A: LIPDC,B: UYVAC,C: RBVEJ,D: LPICD,E: EXPFJ",D,nan,NO_FINAL_ANSWER,nan,100-1019-1,nan
100,1020,100/img/puzzle_100_1020.png,"Rachel conceals words applying the matrix displayed. For example, the word WQE is concealed as VW DW DZ. What word did Rachel conceal LQ DQ LW? A: ADC,B: NBU,C: LCJ,D: SAH,E: TJX",A,nan,NO_FINAL_ANSWER,nan,100-1020-1,nan
100,1021,100/img/puzzle_100_1021.png,"William conceals words applying the grid displayed. For example, the word WLS is concealed as EL GQ EQ. What word did William conceal WQ GQ EJ? A: VIH,B: SCT,C: RLE,D: GCK,E: RLE",C,nan,NO_FINAL_ANSWER,nan,100-1021-1,nan
100,1022,100/img/puzzle_100_1022.png,"Matthew encrypts words using the matrix depicted. For example, the word ASN is encrypyed as YP EB EF. What word did Matthew encrypt WF WP YB? A: JEK,B: MIX,C: MXI,D: UBF,E: YSO",C,nan,NO_FINAL_ANSWER,nan,100-1022-1,nan
100,1023,100/img/puzzle_100_1023.png,"Rachel represents words applying the lattice depicted. For an illustration, the word IUBOP is represented as IO NX IE RE RO. What word did Rachel represent IX RE JE NS FX? A: VOKJM,B: VOKMJ,C: GWSLV,D: PISMA,E: MWKGI",A,nan,NO_FINAL_ANSWER,nan,100-1023-1,nan
100,1024,100/img/puzzle_100_1024.png,"Nathan conceals words applying the board displayed. For instance, the word JKH is concealed as HI MG ME. What word did Nathan conceal SE SI ME? A: GLH,B: GHL,C: INQ,D: DKO,E: TVN",A,nan,NO_FINAL_ANSWER,nan,100-1024-1,nan
100,1025,100/img/puzzle_100_1025.png,"Nathan ciphers words with the grid depicted. For example, the word TOGLJ is ciphered as WA QI TI WO GS. What word did Nathan cipher GI DA GS TA WA? A: JWBHE,B: KRLWX,C: FLKSB,D: QPAWX,E: NCJXT",E,nan,NO_FINAL_ANSWER,nan,100-1025-1,nan
100,1026,100/img/puzzle_100_1026.png,"Joseph encrypts words applying the board displayed. For an illustration, the word MQUF is encrypyed as EI RV DZ RI. What word did Joseph encrypt EZ PV RZ EV? A: JVAG,B: IYSH,C: CARE,D: JVGA,E: HTQO",A,nan,NO_FINAL_ANSWER,nan,100-1026-1,nan
100,1027,100/img/puzzle_100_1027.png,"Kristin represents words employing the board depicted. For an example, the word YSXL is represented as IM RD RB IX. What word did Kristin represent YD WD WM RX? A: RUDO,B: PVFB,C: JDEU,D: KNPC,E: PFBV",E,nan,NO_FINAL_ANSWER,nan,100-1027-1,nan
100,1028,100/img/puzzle_100_1028.png,"Felicia conceals words applying the board shown. For an illustration, the word HAU is concealed as EV NV TJ. What word did Felicia conceal NJ EB TB? A: FXB,B: MEU,C: XPO,D: XPO,E: GTE",C,nan,NO_FINAL_ANSWER,nan,100-1028-1,nan
100,1029,100/img/puzzle_100_1029.png,"Amber encrypts words applying the lattice depicted. For an example, the word YIVP is encrypyed as LO JF BF LF. What word did Amber encrypt EV BY JF BV? A: PCIW,B: HNTM,C: VIKQ,D: GSBD,E: KLIT",E,nan,NO_FINAL_ANSWER,nan,100-1029-1,nan
100,1030,100/img/puzzle_100_1030.png,"Derrick encodes words applying the grid demonstrated. For an example, the word BUGI is encoded as OS LK XS XW. What word did Derrick encode LS XU BS BK? A: CSPK,B: CPSK,C: FIQX,D: VHPB,E: DRBC",A,nan,NO_FINAL_ANSWER,nan,100-1030-1,nan
100,1031,100/img/puzzle_100_1031.png,"Bridget conceals words adopting the lattice pictured. For an example, the word KRD is concealed as OA NA LA. What word did Bridget conceal OB NB LA? A: XUK,B: AFH,C: OHD,D: OHD,E: AWD",C,nan,NO_FINAL_ANSWER,nan,100-1031-1,nan
100,1032,100/img/puzzle_100_1032.png,"Kathryn ciphers words as the matrix depicted. For instance, the word WJBY is ciphered as KQ XS WS XQ. What word did Kathryn cipher WI YQ WS XO? A: VWNX,B: ARBO,C: MQXD,D: MPDJ,E: AORB",B,nan,NO_FINAL_ANSWER,nan,100-1032-1,nan
100,1033,100/img/puzzle_100_1033.png,"Charles encodes words applying the board pictured. For an illustration, the word FQAE is encoded as RX LX OW OM. What word did Charles encode RX LX RW LZ? A: QRAW,B: UYAH,C: FQSN,D: FNSQ,E: PSIG",C,nan,NO_FINAL_ANSWER,nan,100-1033-1,nan
100,1034,100/img/puzzle_100_1034.png,"Jon represents words applying the matrix shown. For example, the word GCKMI is represented as YN TN YR YF BR. What word did Jon represent YN ZR IF BF IJ? A: ELAUC,B: GFRSU,C: BROVS,D: GFURS,E: FBXRC",B,nan,NO_FINAL_ANSWER,nan,100-1034-1,nan
100,1035,100/img/puzzle_100_1035.png,"Catherine represents words as the matrix displayed. For example, the word AEQH is represented as MB KT JT DB. What word did Catherine represent KB MC KG JG? A: ONLY,B: UJVK,C: BKCL,D: VEGK,E: UVKJ",B,nan,NO_FINAL_ANSWER,nan,100-1035-1,nan
100,1036,100/img/puzzle_100_1036.png,"Rebecca represents words applying the board demonstrated. For instance, the word XEGCA is represented as ZY PL SH BY PY. What word did Rebecca represent BV BY PL FV BL? A: FCLTE,B: FCELT,C: HWOJN,D: HBLGS,E: PLUEO",B,nan,NO_FINAL_ANSWER,nan,100-1036-1,nan
100,1037,100/img/puzzle_100_1037.png,"Chelsea encodes words with the board shown. For an illustration, the word YALVM is encoded as HG CZ HU CQ CU. What word did Chelsea encode HZ HU CG BG VZ? A: TARDJ,B: DEIMF,C: WKGOE,D: HPBMQ,E: OLFHT",E,nan,NO_FINAL_ANSWER,nan,100-1037-1,nan
100,1038,100/img/puzzle_100_1038.png,"Anthony ciphers words as the grid pictured. For example, the word LDT is ciphered as CI KI KH. What word did Anthony cipher KQ AH CQ? A: CKL,B: KTQ,C: AGC,D: LXF,E: ERT",C,nan,NO_FINAL_ANSWER,nan,100-1038-1,nan
100,1039,100/img/puzzle_100_1039.png,"Gabriel conceals words with the board displayed. For instance, the word FVQXY is concealed as YI UD YS YP YE. What word did Gabriel conceal FD FP US YI NS? A: SCGFL,B: GETNS,C: EUNFS,D: EUNFS,E: MDARL",C,nan,NO_FINAL_ANSWER,nan,100-1039-1,nan
100,1040,100/img/puzzle_100_1040.png,"John ciphers words applying the grid displayed. For an example, the word PUTEQ is ciphered as BG WF AU PG AF. What word did John cipher WT WJ BU PJ YT? A: HNRGK,B: WULJQ,C: TQGUL,D: IOCRA,E: MJIFB",A,nan,NO_FINAL_ANSWER,nan,100-1040-1,nan
100,1041,100/img/puzzle_100_1041.png,"Kenneth represents words with the lattice displayed. For example, the word AFLKM is represented as PJ AU RZ AZ VU. What word did Kenneth represent VZ PZ BZ RJ VU? A: TBCGM,B: LYFBA,C: TBCMG,D: AMSVD,E: MGTXP",A,nan,NO_FINAL_ANSWER,nan,100-1041-1,nan
100,1042,100/img/puzzle_100_1042.png,"Rachel ciphers words employing the grid displayed. For an illustration, the word BDG is ciphered as KO BH BF. What word did Rachel cipher DH DO BF? A: LBF,B: FUT,C: BXD,D: SRG,E: WTU",D,nan,NO_FINAL_ANSWER,nan,100-1042-1,nan
100,1043,100/img/puzzle_100_1043.png,"Danielle represents words applying the matrix demonstrated. For an illustration, the word TOP is represented as UF OX OM. What word did Danielle represent OF UM GX? A: XEK,B: HER,C: HXK,D: FNH,E: FNH",D,nan,NO_FINAL_ANSWER,nan,100-1043-1,nan
100,1044,100/img/puzzle_100_1044.png,"Natalie ciphers words adopting the board pictured. For an example, the word POIEQ is ciphered as PT CK CS HS PS. What word did Natalie cipher PE PS QU QE QT? A: HFCOT,B: YFAXI,C: HOMTQ,D: NJDAU,E: BQWXN",E,nan,NO_FINAL_ANSWER,nan,100-1044-1,nan
100,1045,100/img/puzzle_100_1045.png,"Victor ciphers words with the grid demonstrated. For example, the word YPHFO is ciphered as AI AP ZP UP FP. What word did Victor cipher MT FJ UJ ZP AR? A: YIXAB,B: RNWMJ,C: FSWBP,D: SOXMF,E: WECHR",E,nan,NO_FINAL_ANSWER,nan,100-1045-1,nan
100,1046,100/img/puzzle_100_1046.png,"Victor conceals words applying the board pictured. For an illustration, the word ICNBO is concealed as YB IU VU VB YW. What word did Victor conceal EW IU IM EJ YM? A: MOFHX,B: UBKWA,C: OWVSY,D: WCFVE,E: PEDAM",D,nan,NO_FINAL_ANSWER,nan,100-1046-1,nan
100,1047,100/img/puzzle_100_1047.png,"Cristina represents words using the lattice demonstrated. For example, the word IHE is represented as FP TO FO. What word did Cristina represent TP FN TN? A: VCD,B: UWM,C: XNH,D: TOC,E: FDV",E,nan,NO_FINAL_ANSWER,nan,100-1047-1,nan
100,1048,100/img/puzzle_100_1048.png,"Charles conceals words adopting the matrix displayed. For an illustration, the word FNSTM is concealed as NQ OL NM GC WQ. What word did Charles conceal GR OQ OM WL OL? A: JSYUP,B: PEQVN,C: GBVLY,D: HAXNE,E: KRXPM",B,nan,NO_FINAL_ANSWER,nan,100-1048-1,nan
